,job_id,job_types,job_tag,post_time,job_title,company,salary,location,no_of_review,job_summary
537,jl_d8f01d4671e9f549,permanent,data+engineer,28 days ago,Paramarine Developer,QinetiQ,,Gosport,160 reviews,"We are looking to appoint an experienced Software Engineer to join an established, highly skilled and dynamic team to support with Paramarine Development...."
538,jl_74470766e9175b2e,permanent,data+engineer,27 days ago,Production Monitoring Solution Engineer,FNZ,,Edinburgh,6 reviews,Data management skills. Have a good understanding in rest based data collection and Powershell scripts. FNZ is looking for a Production Monitoring Solution...
539,jl_f69d951801641a63,permanent,data+engineer,6 hours ago,Service Engineer,Mansell Recruitment Group PLC,"£25,000 a year",Middlesex,,A minimum ONC or equivalent in Electronic Engineering and are ideally an experienced Installation Engineer. An excellent people and motivational skills and the...
540,jl_6b5b7d08282fd3f5,permanent,data+engineer,7 days ago,BMS Engineer,Resourcing Group,"£45,000 - £46,000 a year",Woking,20 reviews,My Client now has an exciting opportunity for a BMS Engineer to join their team at a prestigious site. The role is working on a 24 x 7 shift rota basis....
541,jl_9bf319deff36b97e,permanent,data+engineer,17 days ago,Blockchain Software Engineer,DMSG,"£30,000 - £70,000 a year",Guildford,,Experience of developing data driven applications and web services. Calling all coders!...
542,jl_bb24d6135b49ecc5,permanent,data+engineer,30+ days ago,Materials and Coatings Engineer,Northpoint Recruitment,"£60,000 a year",Oxford,,The company are in their start-up phase and are looking to take on an experienced Materials and Coatings Engineer with a significant chemistry back ground and a...
543,jl_32e2e81c85171696,permanent,data+engineer,5 days ago,Risk Engineer,FPS,,London,42 reviews,Ensure that data stored in the system is up-to-date and accurate. First People Solutions are currently looking for a Risk Engineer who would be keen on a...
544,jl_882536e1407d8018,permanent,data+engineer,3 days ago,CAD Engineer,Fircroft,,Norwich,32 reviews,Fircroft is registered as a Data Controller with the Information Commissioner as required under the General Data Protection Regulation 2016/679....
545,jl_91ff189044cfe33a,permanent,data+engineer,17 days ago,Process Development Engineer - Plasma Etch,Redline Group,,Plymouth,4 reviews,Use SPC to analyse data. Process Engineer job - Plasma Etch - Dorset specific requirements:. An exciting job opportunity has arisen for a Semiconductor Process...
546,jl_7220fe614299f07d,permanent,data+engineer,30+ days ago,Senior Engineer - EMC,TÜV SÜD,,Fareham,7 reviews,Electronic logbook keeping & data collation. Provision of technical supervision to other EMC engineers including competence assessment....
547,jl_ac36397894429cb8,permanent,data+engineer,24 days ago,EDS Intergration Engineer,Fircroft,,West Midlands,32 reviews,Fircroft is registered as a Data Controller with the Information Commissioner as required under the General Data Protection Regulation 2016/679....
548,jl_067b9479657f3739,permanent,data+engineer,30+ days ago,Maintenance Administrator - Hangar Manchester Airport,Jet2.com and Jet2holidays,,Manchester Airport,135 reviews,"You will have strong IT skills to include MS Office and the ability to process large amounts of data. Reporting to the Hangar Supervisor, the Maintenance..."
549,jl_32b63241d1a4ec01,permanent,data+engineer,7 days ago,Senior Software Engineer,National Crime Agency,"£3,258 a month",Leicester,22 reviews,"We are currently looking to recruit G4 Senior Software Engineer. In a team of IT professionals, the Senior Software Engineer will be responsible for the scoping..."
550,jl_130fe10c33841159,permanent,data+engineer,30+ days ago,Research Assistant,Nicholson Glover Consulting,"£20,000 a year",Buckinghamshire,,"They a team of Researchers, Data Scientists, Engineers and Software-lovers and provide a fun, positive, and dynamic work environment that encourages creativity..."
551,jl_8d464d0f0c007337,permanent,data+engineer,30+ days ago,Data Engineer Technical Lead,Harnham,"£80,000 - £120,000 a year",London,6 reviews,"Data Engineer Technical Lead. As Data Engineer - Technical Lead, you will:. To apply for this Data Engineer Tech Lead, please do so via this site...."
552,jl_f2f0307527f009d4,permanent,data+engineer,30+ days ago,Application Support Engineer,University of London,"£25,000 a year",London,19 reviews,Graduate Oracle & Application support Engineer. Our clients build real-time data analytics solutions for the Online Travel Industry....
553,jl_1ff72ca5730f0bd2,permanent,data+engineer,30+ days ago,AVEVA Net Application Support Engineer,Wood,,Reading,944 reviews,Experience of mapping Company data and document structures to Client structures. Establish new Project Portals which effectively reflect Client/Project Class...
554,jl_f2aee7f4615f43d2,permanent,data+engineer,21 days ago,DVP Engineer,Fircroft,,West Midlands,32 reviews,Lead Engineer development (track record of developing engineers into Lead Engineers / Team Leaders). Strong Management Support for Engineers....
555,jl_187cc937a62a7300,permanent,data+engineer,1 day ago,Network Engineer,Mcgregor Boyall,"£55,000 - £65,000 a year",South East,5 reviews,Network Engineer - IDS - IPS - Incident Management - SIEM - Data Loss Prevention - Vulnerability Assessments - Pen TestingOur global trading and investment...
556,jl_dd60c68dcdc68afa,permanent,data+engineer,3 days ago,Infrastructure Engineer,Artemis Recruitment Ltd,"£45,000 a year",Hemel Hempstead,,+ 3rd Line Engineer Project Delivery Engineer Projects Infrastructure Engineer. Data Centre and Cloud. The Senior Project Delivery Engineer will deliver small...
557,jl_e78c643d2ec291af,permanent,data+engineer,3 days ago,Certification Engineer,Matchtech,,Cwmbran,14 reviews,Support Chief Certification Engineer as required. Aerospace Engineer with certification/structures experience writing specifications and reports preferably on...
558,jl_2637d4e13df3c19e,permanent,data+engineer,7 days ago,Wintel Engineer,Clement May Limited,,United Kingdom,,"HP SAN technologies, Virtual Machine Manager 2012, Powershell or Data Protection Manager 2012. We are currently seeking a WINTEL Engineer to provide L4 System..."
559,jl_f80c5e326b34bd70,permanent,data+engineer,5 days ago,Continuous Improvement Engineer,Heybridge Associates Ltd,"£28,000 - £30,000 a year",Shipley,,"Identifying key improvements through Product & Process Flow, Value Stream Mapping, Data analysis and evaluation...."
560,jl_be1480ff724eca32,permanent,data+engineer,30+ days ago,Data Platform Engineer,Deerfoot,"£40,000 - £55,000 a year",London,,"Data Platform Engineer, AI Engineer, Big Data Engineer. Data Platform Engineer c.£40k - £75k basic salary + benefits*...."
561,jl_ecae9f4250df6f0b,permanent,data+engineer,21 days ago,NOC Engineer III,NST RECRUITMENT,"£40,000 a year",United Kingdom,,Advanced 2nd line technical competency level that spans all Data related technologies. Management of all Data Services NOC queues including incident allocation...
562,jl_7ee581ccc8a6af81,permanent,data+engineer,30+ days ago,Senior Data Engineer,Harnham,"£105,000 - £115,000 a year",London,6 reviews,"Senior Data Engineer. Despite the Data team being responsible for Data requests across the group, the two London based Data Engineers are responsible for the..."
563,jl_129f6357f68aad36,permanent,data+engineer,27 days ago,Senior Design Engineer,Ministry of Defence,"£31,696 a year",Helensburgh G84,405 reviews,SENIOR DESIGN ENGINEER (ELECTRICAL). This role will be suited to engineers with experience in Electrical Engineering....
564,jl_7592a816a63cf78f,permanent,data+engineer,30+ days ago,Machine Learning,Man,,London,29 reviews,Experience of data analysis techniques along with relevant libraries e.g. NumPy/SciPy/Pandas. Our front office Engineers are a small flexible team directly...
565,jl_6931fe31263271fc,permanent,data+engineer,3 days ago,Development Engineer,A C Human Resources Ltd,"£35,000 - £45,000 a year",United Kingdom,,"The successful candidate is likely to have been a Senior Mechanical Design Engineer, Mechanical Design Engineer or R&D Engineer within a low volume and / or..."
566,jl_c10ac4d204d6c1f0,permanent,data+engineer,27 days ago,Senior Scientist I,Mondelez International,,Birmingham,"2,389 reviews",Defines system needs to maximise data as an asset to the R&D function including combining data / connecting data from multiple sources....
567,jl_e3a0538c187ef3c0,permanent,data+engineer,1 day ago,Quality Engineer,White Label Recruitment Limited,"£32,000 - £35,000 a year",Bolton,,Analysing data and making appropriate recommendations and improvement plans. Are you an experienced Quality Engineer working within a machine shop environment?...
568,jl_8940c71757993c27,permanent,data+engineer,30+ days ago,Manufacturing Engineer,Michael Page UK,"£34,000 - £37,000 a year",London,32 reviews,Proven track record of working in a Manufacturing / Production / Process Engineer role with processes that include Mechanical and Electromechanical assembly....
569,jl_3ce082d0d27793c8,permanent,data+engineer,30+ days ago,Python Data Scientist / Software Engineer,Harnham,"£65,000 - £100,000 a year",London,6 reviews,Python Data Scientist. A well-established and respected technology company is recruiting a Python data scientist to help understand and process complex sets of...
570,jl_452d89e8d6eec685,permanent,data+engineer,20 days ago,Performance Engineer - Formula E,Pioneer Selection,,Oxford,,Knowledge of various data acquisition systems. Experience as a Performance Engineer in a high-level motorsport environment....
571,jl_c1a3c44ad2f15971,permanent,data+engineer,30+ days ago,Ecologist,Balfour Beatty,,Peterborough,726 reviews,"Experience in using Geographical Information Systems (GIS) packages (ArcGIS, QGIS, MapInfo) for geoprocessing and visualisation of data...."
572,jl_2728235830544544,permanent,data+engineer,19 days ago,DevOps Engineer,Babylon Health,,London,,"We want our engineers to keep learning every day. We are looking for a DevOps Engineer to be part of the team designing, managing, and maintaining our..."
573,jl_232c9f959fe107fe,permanent,data+engineer,1 day ago,Sta Engineer,Envisage Recruitment Ltd.,,United Kingdom,,Capable of measuring supplier quality and assessing data. Collate and evaluate supplier quality data to identify process improvement opportunities within the...
574,jl_f4f94e8319fd87b2,permanent,data+engineer,30+ days ago,"Data Engineer/BI Developer (SQL, ETL, DWH, Azure)",Harnham,"£45,000 - £50,000 a year",London,6 reviews,"Data Modelling (Dimensional, 3NF). DATA ENGINEER/BI DEVELOPER (SQL, ETL, DWH, AZURE). Owning, developing, and maintaining the AJW Data Warehouse...."
575,jl_9deeffcd26e9efd7,permanent,data+engineer,8 days ago,Assembly Engineer,NORCOTT TECHNOLOGIES LTD,,Widnes,,Assembly Project Engineer. As an Assembly Project Engineer you will be responsible for the smooth introduction of customer manufacturing data for prototypes and...
576,jl_be5fd6d1bd1d1c68,permanent,data+engineer,30+ days ago,Process Engineer,CK Group,"£30,000 - £45,000 a year",North London,5 reviews,"Strong experience as Chemical/Process Engineer with sound technical background. Monitor and analyse pyrometallurgical processes and data, supporting resolution..."
577,jl_b732235f14519fdc,permanent,data+engineer,30+ days ago,Data Engineering Lead,Babylon Health,,London,,Bringing data from different data sources and performing data modelling in order to streamline data. Supporting all major teams with data and data insights....
578,jl_60e0001c1e239bec,permanent,data+engineer,9 days ago,Data Scientists ( 2 roles ),VANRATH,"£42,000 - £49,000 a year",Belfast,,This Data Engineer role presents an excellent opportunity to build cutting edge tools; Send your CV or call for a confidential discussion about this Data...
579,jl_e77c1aecd3bdcd12,permanent,data+engineer,30+ days ago,NLP Scientist,Babylon Health,,London,,"As a member of the ML/NLP team, you will have opportunities to interface with the other teams and learn about data science, ontologies, advanced ML methods and..."
580,jl_97dabde7b3882824,permanent,data+engineer,10 days ago,Software .Net Engineer,UK Hydrographic Office,"£24,854 - £28,577 a year",Taunton,3 reviews,"Software .Net Engineer. Software .Net Engineer  JVB B3 (£24,856 - £28,577 with an RRA of up to £3,900). This information will be processed solely by HR, in..."
581,jl_ed2e946433e9135d,permanent,data+engineer,20 days ago,Graduate Engineer,WR Engineering,"£17,000 - £19,000 a year",Paignton,,Requirements for the Graduate Engineer:. Analysis of data and process development. The role of the Graduate Engineer:....
582,jl_9c7b454245ba2d57,permanent,data+engineer,2 days ago,Electronic Engineer – Digital Signal Processing,VANRATH,"£30,000 - £40,000 a year",Belfast,,"Harware, asic, elecrical, dsp, wearable, algorithm, signal, processing, biomedical, technology, electronic, DATA SCIENCE, Digital, embedded, Engineer, Matlab,..."
583,jl_f0731fbcc2831ee0,permanent,data+engineer,30+ days ago,Marketing Data Scientist,Visa,,London,657 reviews,Marketing Data Scientist - London. This role requires a passion for data and someone who sees themselves as a data 'engineer'....
584,jl_5f7df822b577b8d2,permanent,data+engineer,30+ days ago,Software Engineer - Big Data,Linux Recruit,"£55,000 - £65,000 a year",London,,"You will have the opportunity to work alongside Software Engineers, Data Engineers and Scientists on an advanced greenfield platform with Scala as the primary..."
585,jl_a6ce5e7b6b3e4889,permanent,data+engineer,30+ days ago,Design & Release Engineer- Safety Integration,Group Lotus,,Hethel,4 reviews,Understanding of Crash & FEA Data Analysis software. Duties /Responsibilities (Including Objectives of the role):....
586,jl_344d9d5408ebad31,permanent,data+engineer,14 days ago,EDS Engineer,Fircroft,,Swindon,32 reviews,Bringing together 3D modelling data and electrical circuits data). Lead Engineer development. Strong Management Support for Engineers....
587,jl_f150b6fef0c0db0f,permanent,data+engineer,7 days ago,Principle Software Engineer,Inmarsat,,London,32 reviews,Development of data centre applications in AWS. 8+ years of current experience as a hands-on senior software engineer working in team environments....
588,jl_b5fbc1aa84f23af2,permanent,data+engineer,7 days ago,Associate Test Engineer,DWP Digital,,Newcastle upon Tyne,,As an Associate Test Engineer you will be responsible for the testing of products and services used by millions of people in the UK....
589,jl_027b7c3c783b037f,permanent,data+engineer,10 days ago,Quality Engineer,Fircroft,,Stafford,32 reviews,Fircroft is registered as a Data Controller with the Information Commissioner as required under the General Data Protection Regulation 2016/679....
590,jl_041f31b4640c9e4f,permanent,data+engineer,1 day ago,Engineer Vmware,Verticality Ltd,"£55,000 a year",Cambridge,,"Infrastructure Engineer, Data Centre Migration, Data Centre, VMWare, Zerto, Site Reliability Engineer, Infrastructure Engineering etc...."
591,jl_b0343af6231d413a,permanent,data+engineer,20 days ago,Software Engineer,Kudelski SA,,Cwmbran,,We are registered with the Information Commissioner’s Office and fully comply with the requirements placed on us as both a data controller and a data processor....
592,jl_3c8fef23f4c508c4,permanent,data+engineer,30+ days ago,Technical Support Engineer,Mimecast,,London,12 reviews,Assist clients on the entire ingestion process including advising them on best practice guidelines for data preparation and updating them on the ingestion...
593,jl_8f37f2308202b4df,permanent,data+engineer,20 days ago,Design Engineer -,Michael Page UK,"£25,000 - £30,000 a year",Bury,32 reviews,To keep up with demand they are recruiting a design engineer. Update the technical drawing database (Autodesk Vault) to ensure accuracy of files and maintain...
594,jl_1ec6789a40550f4e,permanent,data+engineer,20 days ago,Data Center Engineer - Static,Professional Personnel Management Ltd,,Salford M6,,"Data Center Engineer. The Engineer will also be responsible for the:. Management of site COSHH data and safe storage of materials, also eyewashes, spill kits..."
595,jl_73af89255cbb9ec2,permanent,data+engineer,14 days ago,Senior NOC Engineer - Datacentres / BGP / Juniper,Inspire People,"£50,000 - £75,000 a year",London,,Central London.Key Responsibilities of the Core Network Engineer includes:. This is an excellent opportunity for a mid-level to senior Network Engineer (or NOC...
596,jl_4d19aef43e170715,permanent,data+engineer,29 days ago,Air Traffic Management (ATM) Safety Engineer,QinetiQ,,United Kingdom,160 reviews,"VHF/UHF analogue/digital systems, HF Systems, Satellite communications, Ground networks e.g. AFTN, CIDN, ATN, IPv6, VoIP, Tactical Data Links, Concepts such as..."
597,jl_2e98d1e98f58c875,permanent,data+engineer,2 days ago,Monitoring Officer,Arnold Clark,,Glasgow,280 reviews,Following set protocols and notifying engineers or emergency services if needed. Ensuring information remains confidential in accordance with the Data...
598,jl_190c5b55a3753715,permanent,data+engineer,23 days ago,Data Engineer with own tools and transport - Guildford,Integra People Ltd,£120 - £130 a day,Surrey,,We are currently looking for experienced data engineers with CSCS own tools. We are working with a rapidly growing Data company and as such require data...
599,jl_4a031cdd3a89ce7a,permanent,data+engineer,26 days ago,Process Development Engineer,CK Group,"£30,000 - £40,000 a year",Sedgefield,5 reviews,This will include the preparation of equipment and materials for trials and the recording of process data and relevant observations....
600,jl_60c3e906b6f989f2,permanent,data+engineer,30+ days ago,SOLIDWORKS Sales Engineers Central & South,Solid Solutions,"£22,000 - £30,000 a year",Leamington Spa,7 reviews,"Identifying additional opportunities within customers for simulation, data management, SOLIDWORKS composer, SOLIDWORKS Electrical, training and consultancy...."
601,jl_6c66378cc903f56d,permanent,data+engineer,26 days ago,Process Engineer,Volt Europe,"£30,000 - £40,000 a year",Derbyshire,"3,242 reviews",Producing data to demonstrate productivity and keep up to date with industry practices. Pay:....
602,jl_0b4861ad80f449f5,permanent,data+engineer,1 day ago,NLP Research Engineer,Salt Recruitment,,Greater London,2 reviews,"NLP Research Engineer. Data Science, Data Scientist, Machine Learning, natural language processing, NLP, Python. NLP Research Engineer highlights:...."
603,jl_778c97cf61c83009,permanent,data+engineer,30+ days ago,Software Engineer - Content,Babylon Health,,London,,"As a member of the AI team you will have opportunities to interface with the other teams and learn about data science, deep learning, bayesian networks,..."
604,jl_83e640801a168734,permanent,data+engineer,14 days ago,Engineer,Oaklands Aerospace Limited,"£25,000 - £35,000 a year",Cambridge,,Oaklands Global is currently recruiting a Flight Simulator Engineer on behalf of our reputable flight training academy client based in Cambridge....
605,jl_bdf4d783d99a5931,permanent,data+engineer,14 days ago,Powertrain Performance and Emissions Engineer - PROP943,Jonathan Lee Recruitment Ltd,"£34,000 - £44,000 a year",Warwickshire,4 reviews,"Powertrain Performance and Emissions Engineer - PROP943. Essential - Ability to process powertrain, vehicle test data, analyse and provide technical guidance...."
606,jl_1d665cd85dc8bd2c,permanent,data+engineer,19 days ago,Technical Support Engineer,Michael Page UK,"£23,000 - £25,000 a year",South West,32 reviews,Technical Support Engineer - hardware installation/maintenance experience. Technical Support Engineer - Field based IT support....
607,jl_15b2a4185015999f,permanent,data+engineer,15 days ago,Database Engineer,onezeero,"£40,000 - £48,000 a year",Bingley,,"A role has just become available for a Database Engineer to join our client in Bingley. In this role you will be working to design, develop and deliver database..."
608,jl_b15738693ea26a51,permanent,data+engineer,3 days ago,Sql Server Developer,Dawson & Walsh,"£40,000 - £65,000 a year",London,,"(SQL Server Developer, Database, T-SQL, Stored Procedures, SSIS, SSRS, SSAS, SQL Server 2016, Analyst Programmer, Engineer, Architect, Consultant, SQL Server..."
609,jl_8c7aefbe29190eab,permanent,data+engineer,29 days ago,Electrical Engineer,Perenco,,Bacton,41 reviews,Operations - Electrical Engineer - Operations. Ideally a Chartered Engineer or qualified to a minimum of HNC/HND level....
610,jl_2d42d8abc39a4547,permanent,data+engineer,22 hours ago,Manufacturing Engineer,Jonathan Lee Recruitment Ltd,"£29,000 - £34,000 a year",Stafford,4 reviews,"Will possess good communication and statistical analytical skills, with ability to provide concise insights, conclusions and recommendations drawn from complex..."
611,jl_ef7f63705c8a7f15,permanent,data+engineer,16 days ago,Tooling / Process Engineer,Morgan Ryder,"£45,000 - £52,000 a year",Birmingham,,TOOLING / PROCESS ENGINEER. Facilitate CAD data design reviews. A fantastic opportunity for an experienced Tooling Engineer / Process Engineer to join a West...
612,jl_46171373255e7502,permanent,data+engineer,28 days ago,Antenna Engineer,Cordius,"£40,000 a year",Edinburgh,,They are currently expanding their antenna group and are looking for an Antenna Engineer with an excellent working knowledge of Matlab and/or complex data...
613,jl_66874c9c3f1b3ce7,permanent,data+engineer,1 day ago,Mechanical Design Engineer,Klaw Products Ltd,,Westbury,,"Continuous improvement of the Design Office facility including, processes, procedure, documentation, standards compliance / updates, CAD system and data storage..."
614,jl_80796d57ba2896e4,permanent,data+engineer,8 days ago,Decommissioning Engineer,Matchtech,,Warrington,14 reviews,"The constitution of the basic data (collecting input data from sites). As a ""Nuclear decommissioning & dismantling"" engineer, you will have the following..."
615,jl_3209ec90104921d9,permanent,data+engineer,30+ days ago,Technical Recycling Engineer,SCC,,Birmingham,137 reviews,"To sanitise all data bearing assets, understand removal techniques with focus on data security. Work as part of a data erasure and quality assurance team that..."
616,jl_57e0d0d03cfe294b,permanent,data+engineer,3 days ago,Project Engineer,A C Human Resources Ltd,"£32,500 - £37,500 a year",United Kingdom,,Project Engineers who have worked in sectors such as; Alliance Consulting specialise in the placement of engineers throughout the UK....
617,jl_2ed28e6f379a145b,permanent,data+engineer,12 days ago,Junior Python Engineer / Developer,Harnham,"£30,000 - £40,000 a year",Edinburgh,6 reviews,"Junior Python Engineer. What your role as a Junior Python Engineer will require:. The salary for your role as a Junior Python Engineer is up to £40,000...."
618,jl_de6c62c0a849eb8b,permanent,data+engineer,24 days ago,Junior Development Engineer,Delve Recruitment Limited,"£22,500 a year",Lytham St. Annes,,"Development Engineer, Engineering Technician, Technician, Apprentice, Graduate Engineer, Mechanical Engineer, Maintenance Engineer, Service Engineer...."
619,jl_b80db0656b25cf86,permanent,data+engineer,7 days ago,Senior System Engineer,Kudelski SA,,Cwmbran,,We are registered with the Information Commissioner’s Office and fully comply with the requirements placed on us as both a data controller and a data processor....
620,jl_5f8f3bd8064ed77a,permanent,data+engineer,14 days ago,Assistant Consultant / Consultant CAD Technician,Wood,,Knutsford,944 reviews,"Supporting projects with data analysis and contributing to reports. Working in conjunction with Multi-disciplinary engineers - process, civil and structural,..."
621,jl_f44463f5a3ef157d,permanent,data+engineer,30+ days ago,Senior Big Data Engineer,Harnham,"£65,000 - £75,000 a year",London,6 reviews,Data Engineer (Scala). The expectation is that a Data Engineer will be involved in a blend of client facing work and back end engineering....
622,jl_63dfca5a2ed3df37,permanent,data+engineer,13 days ago,Metrology / Metallurgy Engineer,SF Group,"£34,000 - £40,000 a year",Birmingham,14 reviews,"Publishing detailed dimensional reports, you will ensure all data is clearly illustrated to support design and manufacturing functions...."
623,jl_fc90cb70e53b7a2a,permanent,data+engineer,2 days ago,Applications Engineer,A C Human Resources Ltd,"£40,000 - £42,000 a year",United Kingdom,,Applications Engineer (Electronics Bias). We are looking for an Applications Engineer with the following attributes:....
624,jl_a57d2731cc934bd1,permanent,data+engineer,30+ days ago,UI/UX Engineer,SoulTek,"£40,000 a year",Edinburgh,,SoulTek is delighted to be working with one of Edinburgh's most well know tech companies to find an amazing UI/UX Engineer to join the team ASAP....
625,jl_1937e500e10b6d54,permanent,data+engineer,29 days ago,Database Engineer,Fircroft,,Warwickshire,32 reviews,Fircroft is registered as a Data Controller with the Information Commissioner as required under the General Data Protection Regulation 2016/679....
626,jl_b888b515065f88e1,permanent,data+engineer,20 days ago,Linux infrastructure engineer,Jisc,"£30,500 a year",London,,Linux infrastructure engineer. Working in Jisc as an Infrastructure Engineer puts you at the forefront of the Janet network....
627,jl_076e6418e0a67ca1,permanent,data+engineer,30 days ago,Senior Process Engineer,Xaar,,Huntingdon,3 reviews,"Data driven with excellent analytical skills. The Senior Process Engineer will have ownership over several production processes, for a strategic product..."
