,job_id,job_types,job_tag,post_time,job_title,company,salary,location,no_of_review,job_summary
727,jl_40561d42b679d8b8,permanent,data+analyst,19 days ago,Pricing Analyst,Swinton Group,,Manchester,179 reviews,"Querying large databases to extract and manipulate data, developing and implementing new predictive models, designing and implementing data solutions and..."
728,jl_69d3a374426bae3e,permanent,data+analyst,22 days ago,Promotions Analyst Lead – Pricing and Promotions,ASDA,,Leeds LS11,"5,547 reviews","Analyst, Price and Promotions Analyst. As Promotions Analyst Lead, you will ensure our promotions data and. In a data analysis role...."
729,jl_c2c12674791d7aec,permanent,data+analyst,21 hours ago,Business Analyst - 84125,Deerfoot,"£65,000 a year",London,,Business Analyst - Airline Reservations and Departure Control Systems - 84125. Working as a Business Analyst within the Reservations and Departure Control...
730,jl_fdf9f5883c6946f6,permanent,data+analyst,2 days ago,Senior Compensation & Benefits Analyst,Lockheed Martin Corporation,,Whiteley,"6,417 reviews",Ability to analyse data and deliver information to various knowledge levels through different media. The Reward Partner will provide advice and guidance for all...
731,jl_db4d364c5ac81cca,permanent,data+analyst,5 days ago,Transactions Analyst,BRUIN Financial,,London,,They are looking for a Transactions Analyst to join their team. Experience of data entry work and high levels of accuracy....
732,jl_2c4f7f131f60355e,permanent,data+analyst,1 day ago,"UNDERWRITER, SURETY",Chubb,,London,326 reviews,"Respected market presence within the London brokerage community. Ensure completion of administrative tasks such as reporting, system data entries and..."
733,jl_837cd9097b2f8bbd,permanent,data+analyst,14 days ago,Marketing Analyst,Michael Page UK,"£35,000 - £40,000 a year",Milton Keynes,32 reviews,Marketing Analyst Role. Understand the importance of data and analytics with a passion for them. An exciting opportunity has come available for a Marketing...
734,jl_c0934d19617ecfde,permanent,data+analyst,14 days ago,Pricing Deployment Analyst,Allianz,,Guildford,93 reviews,"We are looking for someone to join our growing, dynamic and fast paced Technical team within Commercial...."
735,jl_27ad7d742f7aaea6,permanent,data+analyst,2 days ago,Service Management Practitioner,NHS Digital,"£33,222 - £43,034 a year",Leeds LS1,"4,005 reviews",The role will require you to be articulate and communicate extremely complex performance data in a way which is appropriate for the audience;...
736,jl_233eede3cb9dbc6d,permanent,data+analyst,30+ days ago,Market Research Analyst,Michael Page UK,"£40,000 - £50,000 a year",London,32 reviews,Strong data and analytical skill set. Great client-side analyst role on offer with clear progression route....
737,jl_4390aa74e3f70509,permanent,data+analyst,8 days ago,Cyber Security Analyst - Cyber Threat Intelligence,Experis,,Nottingham,569 reviews,"Cyber Security Analyst - Cyber Threat Intelligence. You will have experience in collecting, analysing, and interpreting data from various sources, detailing the..."
738,jl_08a3b3b023a6013d,permanent,data+analyst,22 days ago,RFP Analyst,Mason Blake,"£40,000 - £50,000 a year",London,,"Our client, a prominent asset manager, is looking to recruit an RFP analyst to join their Global RFP team based in London...."
739,jl_d56ba4cc52479600,permanent,data+analyst,6 days ago,Configuration Analyst,Capita Plc,,Bristol,"2,017 reviews","Becoming a Configuration Analyst:. We work with a number of notable clients such as Sun Life, Abbeylife and Royal London...."
740,jl_3db861631472ae3d,permanent,data+analyst,1 day ago,Quant Analyst,Oliver James Associates,,London,5 reviews,Quantitative Risk Analyst. Understanding and application of software development and data structures. Quantitative Analyst position sitting with the Quant Desk...
741,jl_6961267a2043ba7c,permanent,data+analyst,30+ days ago,Data Analyst .,Deltra,"£30,000 - £40,000 a year",London,,"Deltra Group, a fast-growing recruitment company in the City of London, that specialise in change and transformation is recruiting a Data Analyst to join their..."
742,jl_f67647439ed1efee,permanent,data+analyst,30+ days ago,GIS Analyst Kent,Open Spaces Ltd.,"£33,000 a year",Kent,,And automated data management processes. Analytical Skills - including the ability to manipulate and interpret complex data sets;...
743,jl_8c8e8218ede6fbcd,permanent,data+analyst,8 days ago,BI Analyst,EasyWebRecruitment,"£22,000 - £26,000 a year",Ascot,,"Business Intelligence Analyst, Business Analyst, BI Analyst, Data Analyst, Reporting Analyst, Information Analyst, Database Analyst, Junior, Power BI, BI..."
744,jl_1ec3e8c99c424f71,permanent,data+analyst,7 days ago,Commissions Analyst,Experis,,London,569 reviews,Commissions Analyst -Competitive Salary - Central London (E14). We are currently recruiting for a Commissions Analyst to join a leading Information and...
745,jl_bb5455c96da8b513,permanent,data+analyst,5 days ago,Application Support Analyst,Etech Partners,"£30,000 - £33,000 a year",London,,"Application Support Analyst - City of London - Finance Sector. Data Analysis - The provision of data support to clients, achieved by developing a comprehensive..."
746,jl_2ec65360a7e108b4,permanent,data+analyst,7 days ago,Marketing Data Analyst,Elder Technologies Limited,,London E1,,As a Marketing Data Analyst at Elder you will be critical to enabling our Marketing team to understand and improve on the performance of activities and...
747,jl_ae70b5d9c77ce494,permanent,data+analyst,2 days ago,Pricing Support Analyst,Exertis Micro-P,,Basingstoke,6 reviews,Pricing Data Creation Timeliness. Assist with routine and ad-hoc pricing data analysis. Highly PC literate with MS Office- particularly Excel & used to dealing...
748,jl_b31fd2badc51834d,permanent,data+analyst,30+ days ago,Data Analyst (Real World Evidence),Carrot Pharma Recruitment,"£40,000 - £50,000 a year",London,,Data Analyst ( Real World Evidence) - Niche Consultancy - London - £40k - £50k Benefits. An understanding of Data Management including electronic data capture....
749,jl_e4ca1a639179832c,permanent,data+analyst,14 days ago,Reporter,Ascential,,London,7 reviews,"As a reporter at Retail Week, you will work in a content team of journalists, analysts, data experts, digital and product editors, videographers and event..."
750,jl_743aef7870202256,permanent,data+analyst,30+ days ago,Data Scientist - Sussex - £70K,Harnham,"£40,000 - £70,000 a year",East Sussex,6 reviews,Data Scientist - eCommerce. Build models based upon comprehensive data sets. Provide actionable insight from complex historical data sets....
751,jl_ef3e5dec050a79e9,permanent,data+analyst,30+ days ago,Applied Statistical Modelling Analyst,Aspire Data Recruitment,"£40,000 a year",Leeds,,"Logistic regression, generalized linear models, categorical data analyses, ANOVA and regression models. In addition, this role involves answering a broad array..."
752,jl_f26cd45a09e98cab,permanent,data+analyst,22 days ago,BUSINESS ANALYST,Gazprom,,Manchester,31 reviews,"Exposure to using SQL for data attribute analysis activities is an advantage. Knowledge of modelling techniques such as UML Use Case, process flow, ERD, Data..."
753,jl_0c605581e6a0f4dc,permanent,data+analyst,22 hours ago,Senior Business Analyst,innogy,"£41,000 a year",Leeds,,We currently have an opportunity for Senior Business Analysts to join our Energy Services Change team. Are you a creative and dedicated Senior Business Analyst...
754,jl_276c542ef7711810,permanent,data+analyst,21 hours ago,Finance Analyst,Codex,"£35,000 - £45,000 a year",Surrey,10 reviews,"Ensuring data is successful boarded into the data warehouse. Finance Systems Analyst – Surrey - £35,000-45,000...."
755,jl_50d830ae120fde12,permanent,data+analyst,6 days ago,Business Analyst,Digital Waffle,"£40,000 - £50,000 a year",Birmingham,,"This company has a growing team of Business Change Professionals, specialising in eCommerce and online retail...."
756,jl_5277222458ab9d6c,permanent,data+analyst,30+ days ago,Data Analyst / Data Architect,InterQuest Group,,London,2 reviews,We are searching  on behalf of a top Investment Management organisation  for a talented Data Analyst or Senior Data Analyst to join the technology...
757,jl_57a59ab597687855,permanent,data+analyst,3 hours ago,Inventory Analyst,Pertemps Network Group,"£24,000 - £26,000 a year",Warrington,520 reviews,Role:- Inventory Analyst. As an Inventory Analyst your duties will be:. Support the Data Systems team in daily activities as required....
758,jl_2f2465d9984c587b,permanent,data+analyst,30+ days ago,IFRS9 Credit Risk Data Analyst,Harnham,£500 - £600 a day,England,6 reviews,IFRS9 Credit Risk Data Analyst. Ability to analyse manual and complex IFRS 9 data to understand drivers for Impairment charge for all retail and corporate...
759,jl_b7c5b51a0c251d42,permanent,data+analyst,30+ days ago,Senior Analyst - Targeting Analytics,Nationwide Building Society,"£30,506 - £44,065 a year",Swindon,488 reviews,"A Senior Analyst in our Targeting Analytics team within Member Contact Strategy. Be a fast learner with an eye for efficiency, and both great attention to..."
760,jl_c16fa53136773f43,permanent,data+analyst,9 days ago,Graduate Analyst,Morgan Turner,"£18,000 - £23,000 a year",Preston,,"Developing internal financial information , taking data from different sources and systems design and build a data repository for data modelling, creating a..."
761,jl_5d6ff0532eb98bd5,permanent,data+analyst,9 days ago,Junior Business Analyst,Fullbrook,,Farnborough,,Knowledge of REST APIs integration to receive data would be beneficial. Ensure that the available data is fully utilized and delivered to senior management...
762,jl_d668674571651239,permanent,data+analyst,6 days ago,Security Analyst / Warwick,Evolution Recruitment Solutions,"£25,000 - £35,000 a year",Leamington Spa,,"Security Analyst / Warwick / £25,000 to £35,000 + 20% Shift Bonus. Triage alarms and security events before handling over to a Senior Analyst...."
763,jl_20a1f4976b3dcd6d,permanent,data+analyst,7 days ago,Media Analyst,The Candidate,"£25,000 a year",Manchester,,The Main Responsibilities of the Media Analyst:. The Media Analyst will focus primarily on analysing both media and buying data in order to provide senior...
764,jl_33a7272fd80dca6c,permanent,data+analyst,30+ days ago,Analyst FMCG Boutique Consultancy,Freshminds Talent,"£32,000 - £34,000 a year",Surrey,,"As an Analyst, you will help the firm to grow its international client base and to continually improve their service and overall client experience, by ensuring..."
765,jl_60c16dae7f1b1a5e,permanent,data+analyst,20 days ago,Data Support Analyst,Harrington Starr,,London,,This is an excellent opportunity for a Data Support Analyst to join a well-established firm. Data Support Analyst/Application Support Analyst – Bristol –...
766,jl_473d8b9e42404cca,permanent,data+analyst,5 days ago,Buying Analyst,Atlas Commercial Recruitment,"£25,000 - £30,000 a year",Rochester,,Provide statistical data analysis to support the development of procurement strategy. The role will require you to support commodity purchases (and other goods...
767,jl_a0d9f6c8b70c2485,permanent,data+analyst,13 days ago,Analyst - Costs,Brewster Pratap,"£25,000 - £28,000 a year",Mexborough,,"Analyst - Costs, Reference:. Development opportunity at a well established, successful growing local business...."
768,jl_0c76fe4fe6a756e1,permanent,data+analyst,17 hours ago,Financial Accountant - Costs,Boots,,Nottingham,"2,791 reviews",Ad hoc queries / reports on cost data. Global Brands is a cross divisional organization of Walgreens Boots Alliance that aims to give WBA retail businesses as...
769,jl_a9dd339303788968,permanent,data+analyst,20 days ago,Business Analyst Junior,WR Engineering,"£25,000 - £30,000 a year",Essex,,Business analyst or applications analyst or applications support experience or something very relevant is required....
770,jl_3d76b80c3e578110,permanent,data+analyst,13 days ago,Data Science Analyst,England Associates,"£35,000 - £74,000 a year",Essex,2 reviews,"Data Science Analyst - Cheltenham. Applied knowledge leveraging scripting skills (Python, Perl, Bash) to find innovative approaches to problems...."
771,jl_7b60029bffc1c1e0,permanent,data+analyst,6 days ago,Google Analytics Analyst - Fashion / Retail,Handle Recruitment Ltd,"£40,000 - £50,000 a year",London,,"Google Analytics Analyst / Data Analyst - Fashion / Retail / eCommerce. Proactively analyse data including Analytics, sales data, SEM performance data and email..."
772,jl_916d539abe18f166,permanent,data+analyst,9 days ago,Customer Insight Analyst,Pertemps Network Group,"£45,000 - £50,000 a year",Stoke-on-Trent,520 reviews,"As a Customer Insight Analyst, you will be required to prioritise and manage key data within the business, support the delivery of the team strategy and also..."
773,jl_0326bce1016afde1,permanent,data+analyst,8 days ago,Gaming Analyst,SRGEurope,,Gibraltar,,"Gaming Analyst Responsibilities:. Educate users to appreciate meaningful data and use this to drive the business forward, seeing data as an asset...."
774,jl_96ac5c0f0c3b3173,permanent,data+analyst,8 days ago,Statistical Analyst in London or Scotland,CK Group,"£30,000 - £40,000 a year",London,5 reviews,"This is a permanent, full time position, based out of their site in London or Scotland. Knowledge of CDISC standard databases (SDTM and ADaM) and data..."
775,jl_10aa782487d0a9e4,permanent,data+analyst,9 days ago,Senior Analyst - Smart Energy,Gemserv,"£27,500 - £31,000 a year",London,3 reviews,Senior Analyst - Smart Energy. We are passionate about helping drive the energy market transformation and data revolution....
776,jl_81dda74f11b0cb91,permanent,data+analyst,28 days ago,Rewards Insights Analyst - London - Global Brand!!,Lawrence Harvey,"£38,000 - £48,000 a year",London,,Rewards Insights Analyst - London - Global Brand!! Utilising your exceptional data analysis skills you will wrangle data from multiple disparate sources such as...
777,jl_662f1be00d6ffafa,permanent,data+analyst,30+ days ago,Higher Statistical Officer across the GSS,Government Statistical Service,"£31,029 a year",Cardiff,, Use innovative techniques to acquire new data sources. Statisticians  Data analysis. Statisticians  Presenting and disseminating data effectively....
778,jl_a583400d849c88f0,permanent,data+analyst,9 days ago,Campaign Analyst,IT New Business,"£35,000 - £40,000 a year",London,,"A client of mine, based in London, are looking for a Campaign Analyst to come in and help develop incisive campaign insights...."
779,jl_ab6e6c1a8cfb5744,permanent,data+analyst,30+ days ago,PMO Front End Analyst,Capgemini,,South East,"6,077 reviews",An ability to methodically manage and analyse data. A Front End analyst is required to support the Capgemini SAP business unit in Worthing....
780,jl_aa87815ec33d205f,permanent,data+analyst,21 hours ago,Business Analyst,Cyber Team,,London,,"Strong technical background appreciation especially in Relational Databases, Data warehousing, ETL, different data models, data migration and reporting writing...."
781,jl_0b94a61b97555dfb,permanent,data+analyst,30+ days ago,Technical Analyst,Capita Plc,,Southampton,"2,017 reviews","Becoming a Technical Analyst with Capita – Fixed Term Contract. You’ll be joining a network of some of the most experienced, innovative and dedicated people in..."
782,jl_2e48bb0b72e484ec,permanent,data+analyst,30+ days ago,Systems Analyst - Central London - 50-55K,Ivy Blu,"£50,000 - £55,000 a year",London,,"Working alongside the Application Analysts, Business Analysts, Development Analysts and the rest of the IT team to ensure the workload is properly defined,..."
783,jl_053d01afd3120221,permanent,data+analyst,30+ days ago,Data Analyst,Quattro Recruitment,"£20,000 - £25,000 a year",York,8 reviews,"IT Helpdesk, SAP, IT Systems Administrator, IT Technician, Data Analyst, BI Reports. Experience of Data Analysis work. IT System Administrator...."
784,jl_ffdfbd598b7c1858,permanent,data+analyst,9 days ago,Content & Insight Analyst,Stopgap,"£35,000 a year",London,,"To be data driven, and have a keen interest to use your analytical skills in collating and interpreting data to provide detailed analysis and recommendations on..."
785,jl_5800581720b54bed,permanent,data+analyst,14 days ago,AML Analyst,SRGEurope,,Gibraltar,,Compile and advise on investigation data. The AML Analyst Responsibilities are but not limited to:. The AML Analyst Skills & Experience are but not limited to:....
786,jl_532e20ffe3cba29d,permanent,data+analyst,5 days ago,Data Developer,Post Office Ltd,"£55,000 a year",Chesterfield,273 reviews,To create data dependency diagrams & identify data suppliers vs data consumers. To create data flows & data dictionary or ERD’s....
787,jl_722570b0c66f94e2,permanent,data+analyst,6 days ago,Data Protection Analyst (SCCM/ Vmware),Cooper Lomaz Recruitment,,Peterborough,,"Data Protection Analyst- Peterborough- Up to £40,000. A large multinational company, are looking for a Data Protection Analyst to join their team...."
788,jl_6a1458698a6853a5,permanent,data+analyst,30+ days ago,IBMO Commodities Analyst,Barclays,,London,"4,332 reviews",IBMO Commodities Analyst - 90197728. Intra and End of day data integrity across various systems and applications....
789,jl_714fe8c6a72f02ee,permanent,data+analyst,23 days ago,Associate - Commercial Research,Knight Frank,,London,63 reviews,Our Commercial division are looking to recruit an Associate Research Analyst to specialise within Capital Markets and to work within our expanding Research team...
790,jl_476d1a1f9aa6b5fb,permanent,data+analyst,30+ days ago,Pricing Analyst,Communisis,,London,29 reviews,"Previous experience of manipulating and analysing numerical data. Collates, evaluates, manipulates and draws conclusions from data, using this information to..."
791,jl_c40b578b7cea6c89,permanent,data+analyst,21 days ago,Business Data Analyst,BRUIN Financial,,London,,"The ability to understand concepts such as Database design, Logical Data Models, SQL, Data Science, Big Data, Digital technologies...."
792,jl_687f2666a6bdc95f,permanent,data+analyst,22 days ago,Business Analyst,Legal & General Investment Management,,London,15 reviews,"Must have worked in a fund management company as a business analyst supporting teams who use risk analytics, for example, portfolio managers, traders and..."
793,jl_f4312d0572a004d8,permanent,data+analyst,7 days ago,Business Development Analyst - Global Drinks Brand,Michael Page UK,"£35,000 - £40,000 a year",London,32 reviews,"They are fast growing with huge ambition to continue their International success. As the Business Development Analyst - Global Drinks Brand, you will have:...."
794,jl_62aad6154cb2350d,permanent,data+analyst,15 days ago,Analyst,Ascendant Recruitment,"£24,000 - £26,000 a year",Milton Keynes,,Take the lead in data analysis and results compilation for products/servicesResearch projects working to a client brief to deliver insight Has a good...
795,jl_847615fecde61d8c,permanent,data+analyst,19 days ago,Analyst,Faststream Recruitment,"£35,000 - £45,000 a year",London,,Faststream is recruiting for an Analyst to join a well regarding Ship Operations & Management business in London....
796,jl_a3bfd94f06995ac5,permanent,data+analyst,12 days ago,Directly managed capital (DMC) risk analyst,Thames Water Utilites,"£32,000 a year",Reading,16 reviews,We are looking for a Risk Analyst to form part of the managing operational risks team within our Thames Valley region....
797,jl_f0a9f2b8f0ee7a62,permanent,data+analyst,23 days ago,Security Analyst,Inmarsat,,London,32 reviews,Act as a first line security event analyst monitoring the Security Information and Event Management (SIEM) System....
798,jl_6db2692de7eace3c,permanent,data+analyst,30+ days ago,Data Analyst,Agile Recruitment Ltd,,London,,"If you're currently a business data analyst, data quality analyst, master data analyst, data governance analyst with strong SQL skills you could be the next..."
799,jl_b15e00609b35fa49,permanent,data+analyst,30+ days ago,Customer Analyst,Harnham,"£45,000 - £50,000 a year",London,6 reviews,"The company are currently in the middle of developing their analytics architecture, moving to innovative cloud based platforms, allowing you to display a..."
800,jl_091f65a22b3b5afd,permanent,data+analyst,2 days ago,Settlement Operations Analyst,Huntress,"£27,000 - £29,000 a year",London,24 reviews,An exciting opportunity has arisen for a Settlement Operations Analyst to join a growing team within the energy industry....
801,jl_e7aa58d5d08ba09e,permanent,data+analyst,22 hours ago,Junior Operations Analyst,Huntress,"£22,000 - £28,000 a year",Croydon,24 reviews,A phenomenal opportunity has opened for an entry level Operations Analyst to join a successful and rapidly growing team....
802,jl_476e66e0ee1de745,permanent,data+analyst,23 hours ago,Digital Business Analyst,Knight Frank,,London,63 reviews,"You will also have experience of working on highly interactive website application developments, which implement complex data requirements and business..."
803,jl_4f3fb4bbbae726d7,permanent,data+analyst,27 days ago,MI Analyst,Brewster Pratap,"£25,000 - £34,000 a year",Doncaster,,"MI Analyst, Reference:. As MI Analyst duties will include:. The Brewster Pratap Recruitment Group are currently working alongside a Doncaster based business to..."
804,jl_867d58344cdb7d27,permanent,data+analyst,29 days ago,PMO Analyst,FNZ,,London,6 reviews,"Solve business problems by building data models and defining the process of data collection, analytics and communication of outcome...."
805,jl_937da8b529f99791,permanent,data+analyst,30+ days ago,Data Quality Analyst,Recruitment Partnership (Bristol) Limited,"£40,000 - £45,000 a year",Swindon,,Data Quality Analyst. The Data Quality Analyst/ BI Analyst will work in a SQL Server environment. My client is an innovative software company and is offering a...
806,jl_6867970179d18583,permanent,data+analyst,2 days ago,Clientside,Nicholson Glover Consulting,"£40,000 a year",London,,"Experience analysing and interpreting data to present stories in a compelling way. Amazing offices in Camden, North London, especially if you enjoy a tipple!..."
807,jl_3fb910fe44466e71,permanent,data+analyst,24 days ago,Business Analyst (Business Continuity and Information Assura...,BDO,,London,"1,010 reviews","BDO LLP is an accountancy and business advisory firm, we provide integrated advice and solutions to help businesses navigate a changing world. Our clients are..."
808,jl_2e04e7a8717d559a,permanent,data+analyst,10 days ago,Data Analyst (Manager),Hillman Saunders,,London,,You will be tasked with leading its Data Analyst team and leveraging its unique data warehouse and real-time data capture capabilities to build modern solutions...
809,jl_7ee9cd06b8ac73af,permanent,data+analyst,1 day ago,Reinsurance Reporting Analyst,Jenrick Group,"£40,000 - £45,000 a year",London,,"Reinsurance & Reporting Analyst (Spanish Speaking) Monument, Amazing Growing Co. · Accountability for data on BRIDGE (data uploading/editing) ensure accuracy of..."
810,jl_d8418d4243811737,permanent,data+analyst,30+ days ago,Testing and Support Analyst,euNetworks GmbH,,London,2 reviews,"Complete bulk imports of data and data fixes using scripts. You will be working with a high performing IT Development team, working closely with developers and..."
811,jl_d53cde3930316136,permanent,data+analyst,6 days ago,Project Accountant - Consulting,KBC Global,,Walton-on-Thames,,"Maintain accurate live data of all planned invoices. Collection of necessary start up project data, budgets, resourcing, margins, client contacts, PO’s,..."
812,jl_67acae4c5a17658f,permanent,data+analyst,2 days ago,Customer & Product Insight Analyst,Aspire Data Recruitment,"£38,000 a year",Northampton,,"Customer & Product Insight Analyst. You will have a background in marketing data analysis, CRM, campaign management or data and insight supporting process..."
813,jl_053c88f6eb88b97b,permanent,data+analyst,30+ days ago,Customer Analyst - SQL/R/Google Analytics,Harnham,"£35,000 - £50,000 a year",London,6 reviews,Must be innovative with how you use the data. Customer Analyst - SQL/R/Google Analytics. Focusing on customer level data you will observe which channels are...
814,jl_0d8df1d4a0222a67,permanent,data+analyst,30+ days ago,Online Journey Insight Analyst,Harnham,"£35,000 - £40,000 a year",London,6 reviews,"Online Journey Insight Analyst - UX. To do this, you will need to have experience in user research, customer journey mapping, data analysis, web analysis and..."
815,jl_2b30038f6103587e,permanent,data+analyst,30+ days ago,Insight Analyst,Blue Pelican,"£25,000 - £35,000 a year",London,,POSITION – Insight Analyst. Comfortable working with large customer data sets (millions of rows). LOCATION – Central London....
816,jl_98365bf14de51f6d,permanent,data+analyst,7 days ago,Performance Analyst,Green Recruitment Solutions Ltd,"£30,000 a year",Bristol,,Good skills of data entry and skilled in performance monitoring. Green Recruitment Solutions are seeking a Performance Analyst for a leading company in Solar...
817,jl_1d8658f53d0079a0,permanent,data+analyst,30+ days ago,Statistical Analyst – SAS/SQL,Aspire Data Recruitment,"£25,000 - £30,000 a year",Leeds,,As a Statistical Analyst you will:. Put forward recommendations to senior management based on data driven analysis....
818,jl_30996aee30e6b7e8,permanent,data+analyst,19 days ago,Analyst,Cherry Professional,"£23,000 - £25,000 a year",Nottingham,,"Jobs you may have applied for include Finance Analyst, Commercial Analyst, MI Analyst, Business Analyst, Cost Analyst, Billing Analyst and Analyst...."
