,job_id,job_types,job_tag,post_time,job_title,company,salary,location,no_of_review,job_summary
717,jl_1259b8c627cf55b2,permanent,data+engineer,15 days ago,Calibration Engineer,Gen Tec Recruitment,"£50,000 a year",West Midlands,,Calibration Engineer Requirements:. Calibration of main functions for Hybrid Dual Clutch Transmission and Gasoline TGDI Engine.Development of calibration tools...
718,jl_9f70574f643fa11a,permanent,data+engineer,10 days ago,Desktop Support Engineer,Monarch IT,"£30,000 - £32,000 a year",Coventry,,"Desktop Support Engineer. Data issues on end-users computers (integrity checks, transfer, restore). We currently have an urgent requirement for a Desktop..."
719,jl_1c75e40210747cfe,permanent,data+engineer,30+ days ago,(Senior) Data Acquisition Scientist DIAD,Diamond Light Source,"£33,297 - £39,172 a year",Didcot,5 reviews,The Data Acquisition Software. Real-time visualisation of collected data. Capture and storage of experimental data;...
720,jl_6c5a9216a03f9cee,permanent,data+engineer,1 day ago,2Nd Line Support,Etech Partners,"£35,000 a year",London,,In return you will receive full training in Market data apps like Bloomberg and Reuters. My Client are a Private Investment Bank are looking for a 2nd/3rd Line...
721,jl_0c835269c938a17e,permanent,data+engineer,30+ days ago,Civil Engineer (DTB00330),Bovis Homes,,Exeter,20 reviews,"Bachelor of Engineering degree (BEng), or, • Masters degree in Civil Engineering (MEng), or • HNC/HND at technician level but must be willing to complete a..."
722,jl_8a3225cd2f092d83,permanent,data+engineer,13 days ago,Ground Engineer,Astute Technical,"£20,000 - £35,000 a year",Bristol,,Collating data and report writing. Our client is looking for an exceptional Ground Engineer to join their geo-environmental site investigation company....
723,jl_966b4ac4eac20231,permanent,data+engineer,30+ days ago,Assistant Software Engineer,Sony UK Technology Centre,,Pencoed,,"Candidates with a suitable Engineering or Science degree are invited to apply for a position within a multi-disciplinary manufacturing facility, focusing on..."
724,jl_9455b93e35cbff29,permanent,data+engineer,30+ days ago,Software Engineer,Barclays,,Northampton,"4,332 reviews",Software Engineer - 90197873. Supporting VP Lead Software Engineers and mentoring BA4 Software Engineers. Job Title Senior Software Engineer....
725,jl_33a2ab0fbd44dc86,permanent,data+engineer,30+ days ago,Scheduler,Fresh Recruit,,Stevenage,,Planning PPM visits using engineer skills matrix to maximise engineer efficiency. Agree out of hours requirements with engineers directly....
726,jl_dd0d66f7d4473c80,permanent,data+engineer,7 days ago,Junior DevOps Engineer,Harnham,"£40,000 - £45,000 a year",London,6 reviews,"JUNIOR DEVOPS ENGINEER - JENKINS, PUPPET, TERRAFORM, MCOLLECTIVE. As a Junior DevOps Engineer you will be:. Previous experience as a Junior DevOps Engineer in a..."
727,jl_f5f080bc64ae373a,permanent,data+engineer,22 days ago,Mechanical Engineer,Addtec,"£40,000 - £41,500 a year",Leicester,,"There are 2 vacancies Mechanical Engineer. Travel to work from Leicester, Loughborough, Coventry Mechanical Engineer...."
728,jl_d58c8c8485e814e8,permanent,data+engineer,30+ days ago,Controls Technician (Buildings),Transport for London,,London,263 reviews,"Job - Mechanical & Electrical Engineer. Ability to analyse data, draw conclusions, produce reports and make recommendations (E)...."
729,jl_068c99c4c052ac74,permanent,data+engineer,2 days ago,Field Service Engineer,Fircroft Engineering Serv Ltd (Contract),,United Kingdom,,Fircroft is registered as a Data Controller with the Information Commissioner as required under the General Data Protection Regulation 2016/679....
730,jl_2467232df27f5e03,permanent,data+engineer,2 days ago,Immunoassay Development Scientist,CK Group,"£28,000 - £35,000 a year",Oxfordshire,5 reviews,"Data collection and analysis. Interact with a large, technically diverse team of scientists and engineers to integrate and optimise sensors for reliable..."
731,jl_ad7082164635e2c2,permanent,data+engineer,5 days ago,Senior Digital Engineer,Laing O'Rourke,,London,263 reviews,Assets data management. Laing O’Rourke have current needs for Digital Engineers to lead the implementation and delivery of project DE strategies....
732,jl_c4143f0db9b3b8fb,permanent,data+engineer,30+ days ago,Technology Consultant,BJSS,,Nottingham,,"The ability to delve into deep data analysis and then synthesise the key messages / ""so whats"". Embracing the latest developments in technology and our clients..."
733,jl_75bac0d1afa94ed0,permanent,data+engineer,30+ days ago,Data Architect/BI Engineer,Harnham,"£50,000 - £60,000 a year",London,6 reviews,"Creating and managing marketing data storage / analysis environment- namely an AWS Data lake. To build, maintain and automate data analysis marts which sit on..."
734,jl_bf05febae7a0193f,permanent,data+engineer,30+ days ago,Data Scientist Lead,Babylon Health,,London,,"Lead, manage & mentor a team of data analysts & data scientists. Data mining using state-of-the-art methods. We are looking for a Data Scientist Lead that will..."
735,jl_693a24275bdb02bb,permanent,data+engineer,24 days ago,Commercial Analyst,RS Components,,Corby,166 reviews,To enable programmes through simplification of big data. Understands the needs of engineers and buyers (our target customers)....
736,jl_fba695712917d33b,permanent,data+engineer,4 days ago,Javascript Engineer,Howard Finley Ltd,"£50,000 - £70,000 a year",London,,"Senior Software Engineer - JavaScript, Data Driven Product. Senior JavaScript Engineer. Senior Software engineer experience...."
737,jl_816e5a85b9c9a5cb,permanent,data+engineer,30+ days ago,Weights Engineer,First Recruitment Group,,Monmouthshire,4 reviews,"Good mathematical/numerical skills to generate cost and weight data KPI’s. We actively recruit at all levels – such as Trainee, Graduate, Senior, and Management..."
738,jl_ef4706bb1f760f9c,permanent,data+engineer,30+ days ago,Datacenter Engineer Amsterdam,Open Spaces Ltd.,,United Kingdom,,Data Centre Engineer. Microsoft Certified System Engineer (MCSE) certifications in Windows 2008 or Windows 2012 are strongly preferred....
739,jl_838120fefc7c7d25,permanent,data+engineer,16 days ago,Data Science Consultant,Harnham,"£90,000 - £95,000 a year",London,6 reviews,Data Science Consultant. A proven background in delivering Data Science/Big Data projects for clients. Experience in delivering projects with cross-functional...
740,jl_cd3b4b3eb02bba80,permanent,data+engineer,22 days ago,EDS Project Engineer,Fircroft,,Leamington Spa,32 reviews,EDS Project Engineer. Strong Management Support for Engineers. Fircroft is registered as a Data Controller with the Information Commissioner as required under...
741,jl_03018cb73ac97ecd,permanent,data+engineer,2 days ago,Principal ecologist (Ecology manager),Wessex Water Services Limited,,Bath,8 reviews,"Tools to track biodiversity loss/gain and promoting in-field data collection using mobile mapping solutions). As ecology manager, you will be working alongside..."
742,jl_2861d05ce9df078c,permanent,data+engineer,14 days ago,"Data Engineer (SQL, Python, ETL, AWS)",Harnham,"£50,000 - £60,000 a year",London,6 reviews,A well established financial technology company are looking to bring a new data engineer on board in order to design and implement new data models and ETL...
743,jl_48ff7fca94520567,permanent,data+engineer,6 days ago,Senior Data Engineer,Sk Consultancy Solutions Limited,,London,,"Is currently hiring for passionate, energetic data engineers, who are focussed on using their skills to drive out real business value from their data assets to..."
744,jl_959bb8b7af372337,permanent,data+engineer,30+ days ago,Principal Process Engineer - Steam Cracking,Wood,,Reading,944 reviews,Chartered Chemical Engineer status. Participate in technical meetings and handle discussions with client engineers....
745,jl_1e2b3bcb72fd066f,permanent,data+engineer,30+ days ago,Software Engineer,Sony UK Technology Centre,,Pencoed,,"Candidates with a suitable Engineering or Science degree are invited to apply for a position within a multi-disciplinary manufacturing facility, focusing on..."
746,jl_68e28363753948f9,permanent,data+engineer,30+ days ago,Automation Process and Project Engineer,Saint-Gobain,,Suffolk,"2,262 reviews",Who are we ? Innovative? Customer Focused? Agile? Open and Engaging? Entrepreneurial? – The key attitudes and way we like to work at Saint-Gobain. If this...
747,jl_7699e55557174f0e,permanent,data+engineer,30+ days ago,Senior Big Data Engineer - Scala/Spark,Linux Recruit,"£60,000 - £85,000 a year",London,,"You are either a Big Data or Scala Engineer with exposure and understanding of working in a data focused environment, designing and building data platforms...."
748,jl_2a0ca01fe85b3ecf,permanent,data+engineer,17 days ago,Vice President EMEA CoE,RS Components,,Corby,166 reviews,"RS Components is a trading brand of Electrocomponents plc, the global distributor for engineers. The VP EMEA Centre of Expertise role provides leadership and..."
749,jl_fc84994b31da37b2,permanent,data+engineer,7 days ago,Software Systems Engineer,Diamond Light Source,"£33,297 - £39,172 a year",Didcot,5 reviews,"The duties includes working within a team of Software Systems Engineers in the Beamline Controls Group, and liaising closely with other groups of scientists,..."
750,jl_16c54d4e3c19dac5,permanent,data+engineer,13 days ago,Big Data Engineer – Google Cloud - BI - SQL - Python - Scrip...,Reflex Computer Recruitment Ltd,"£60,000 - £65,000 a year",London / Gatwick Airport,,"So, if you are an experienced Data Engineer – Data Visualizer – Data Architect – Big Data Engineer with Data Engineering / BI Development / Data Warehousing..."
751,jl_02ed7fd1f918b197,permanent,data+engineer,6 days ago,Operations and IMS Support Engineer Gibraltar,SRGEurope,,Gibraltar,,Operations and IMS Support Engineer Profile:. Custodian of Material Safety Data Sheet (MSDS) system. Monthly collection of IMS data and reporting via the...
752,jl_80e04f937039d841,permanent,data+engineer,9 days ago,Network Engineer,onezeero,"£45,000 - £50,000 a year",London,,"Experience within data centre environments. As the Network Engineer, you will be working predominantly on projects including the delivery on new Data and..."
753,jl_431d6110e86df071,permanent,data+engineer,30+ days ago,Project Engineer BWD,Wood,,Barnwood,944 reviews,"Approvals of the Project Engineer in principle are as follows:. Providing accurate and timely information, data and reports regarding the project status,..."
754,jl_29a870f0a6f46871,permanent,data+engineer,30+ days ago,Data Scientist,Redline Group,"£40,000 a year",Cambridge,4 reviews,Also call for more information on other Data Scientist / Engineer or Algorithm development jobs UK wide. Skills required for this Data Scientist job -....
755,jl_39d774396d45680b,permanent,data+engineer,30+ days ago,Data Engineer with own tools and transport - Bradford,Integra People Ltd,£109 - £110 a day,West Yorkshire,,Data cabinet installation. We are currently looking for experienced data engineers with CSCS own tools and transport....
756,jl_e4b716438b168294,permanent,data+engineer,5 days ago,Infrastructure Engineer,Klarion Ltd,"£40,000 a year",London,,Maintain and review configuration data (e.g. 5 + years' experience in an IT Systems Engineer / Administration role....
757,jl_2f83a8f0d4d24aba,permanent,data+engineer,30+ days ago,Junior Electrical Design Engineer,Skyline Engineering Solutions LTD,,Greater London,,Data manipulation of original drawings according to specification revisions. Job Profile - Graduate....
758,jl_be007cbbb20029f8,permanent,data+engineer,21 days ago,Verification Engineer,Matchtech,,Welwyn Garden City,14 reviews,In conjunction with the reliability engineer define and plan the test strategies for products and subsystems....
759,jl_73de8e9c6ae0a57c,permanent,data+engineer,6 days ago,Product Support Engineer,ATA Recruitment Ltd,"£38,000 a year",Wembley,12 reviews,"Job Role – Product Support Engineer. Analysing data and trends, you will develop solutions and liaise with Engineering and Production teams whilst retaining..."
760,jl_8103d7c803720375,permanent,data+engineer,13 days ago,Machine Learning Engineer,Blackfield,"£42,000 - £49,000 a year",Bedfordshire,,Data Acquisition - design and implement new ways to make data available from trials at the pilot plant and production scale....
761,jl_d6790f7a386cf9f3,permanent,data+engineer,1 day ago,Hardware Engineer,Digileap Ltd,"£50,000 a year",Northampton,,Hardware Integration Engineer. My client a leading technological company focusing on gathering real-time intelligence to optimise and solve transportation...
762,jl_ae73ae1b058b567d,permanent,data+engineer,30+ days ago,Data Engineer with own tools and transport - Glasgow,Integra People Ltd,£109 - £110 a day,Scotland,,Data cabinet installation. We are currently looking for experienced data engineers with CSCS own tools and transport....
763,jl_ad966d90b3f17dcf,permanent,data+engineer,30+ days ago,Senior Engineer,Ringway Jacobs,,Aylesbury,22 reviews,"To be responsible to ensure the database is maintained, new works are added promptly and to focus on improving the accuracy of the data...."
764,jl_9a389e86fb321472,permanent,data+engineer,9 days ago,Electrical / Mechanical Engineer,Fircroft,,Aberdeen,32 reviews,Fircroft is registered as a Data Controller with the Information Commissioner as required under the General Data Protection Regulation 2016/679....
765,jl_d89903f324dc871b,permanent,data+engineer,1 day ago,It Security Engineer,In touch games,"£30,000 - £40,000 a year",Halesowen,,"IT Security Infrastructure Engineer. Data networking expertise (inc switches, routers etc). IT Infrastructure, IT Security, Network Engineer, Server, Windows,..."
766,jl_6f91459d7aa0bf6c,permanent,data+engineer,2 days ago,Applications Engineer,Key Recruitment (UK) Limited,"£40,000 - £45,000 a year",United Kingdom,,Provides information and interpretation of data for use by the company or customers. Develop good understanding of customers’ pipeline business and operation....
767,jl_ec805e1dcb762018,permanent,data+engineer,30+ days ago,Weights Engineer,Matchtech,,Cwmbran,14 reviews,Aerospace Weights Engineer to monitor and control product weight. Good mathematical/numerical skills to generate cost and weight data KPI's....
768,jl_3dc4e71d1f6b7ec5,permanent,data+engineer,7 days ago,Production Engineer,Elevation Recruitment,"£35,000 - £50,000 a year",Doncaster,,"Generate, maintain and update routings and costing data. We are interested in speaking with Production Engineers who can demonstrate the following;..."
769,jl_6483782ec6ae28b4,permanent,data+engineer,6 days ago,Physicist,Fircroft,,Warrington,32 reviews,Fircroft is registered as a Data Controller with the Information Commissioner as required under the General Data Protection Regulation 2016/679....
770,jl_1f1b4fcce8fee6ad,permanent,data+engineer,19 days ago,Senior QA Engineer,Somo,,London,,Create and maintain automation test libraries to be reused by fellow quality engineers. You are a Senior QA Engineer with a strong background in automation...
771,jl_6977a56b1f88b35b,permanent,data+engineer,30+ days ago,Senior Lead Engineer - NVH,Group Lotus,,Hethel,4 reviews,In depth knowledge of LMS software and associated data processing techniques. Duties /Responsibilities (Including Objectives of the role):....
772,jl_488e211d2e173c54,permanent,data+engineer,16 days ago,"Project Engineer Electrical, C&I - Hartlepool",Wood,,Hartlepool,944 reviews,"Approvals of the Project Engineer in principle are as follows:. Providing accurate and timely information, data and reports regarding the project status,..."
773,jl_da84ac84682610cd,permanent,data+engineer,30+ days ago,Principal Process Engineer,Wood,,Reading,944 reviews,Chartered Chemical Engineer status. Participate in technical meetings and handle discussions with client engineers....
774,jl_9f90d997bb5d11ea,permanent,data+engineer,30+ days ago,Principal Process Engineer - Petrochemicals,Wood,,Reading,944 reviews,Chartered Chemical Engineer status. Participate in technical meetings and handle discussions with client engineers....
775,jl_9fbb3c5e6b966aec,permanent,data+engineer,30+ days ago,Lucy Electric UK - Quality Manger,Lucy Group,,Thame OX9,,"CQI (Chartered Quality Institute) certified Quality Engineer or equivalent. Provide support to the Supply Chain Management organisation in the collection,..."
776,jl_19fc1a976c6e377d,permanent,data+engineer,22 days ago,Condition Monitoring Engineer,Jonathan Lee Recruitment Ltd,"£34,000 - £37,950 a year",Coalville,4 reviews,Mobile Equipment Condition Monitoring Engineer. The successful Condition Monitoring Engineer will possess;...
777,jl_749451e190480592,permanent,data+engineer,30+ days ago,DevOps Engineer – Data Centre,System Recruitment,"£45,000 - £55,000 a year",Farnborough,,DevOps Engineer – Data Centre. Essential Requirements - DevOps Engineer – Data Centre. The role will suit individuals currently working as DevOps Engineer –...
778,jl_65b3cc1ce2402e1c,permanent,data+engineer,26 days ago,IT HELP DESK ENGINEER,Future,,London,,Experience of mobile data devices. The IT department provides a wide range of IT systems and services to Future Publishing....
779,jl_b82538bac48fc144,permanent,data+engineer,30+ days ago,On Wing Support Engineer,CAS Recruitment,"£45,000 a year",United Kingdom,,"(SW94) On Wing Support Engineer. Able to navigate and find relevant data within the OEM manuals (EMM, AMM, PPBUM, IPC, SPM...)...."
780,jl_4bdda0f466825518,permanent,data+engineer,30+ days ago,Focal Engineer,Fuel Recruitment,"£45,000 a year",Camberley,,To add value and highlight trends within the call data. In the role of Focal Engineer (Security) you will be expected to;...
781,jl_d630f0f08bb6ede6,permanent,data+engineer,24 days ago,Software Engineer,General Dynamics UK,,Chippenham,3 reviews,GDB Job Description - Software Engineer UE - P3 Engineer.docxGDB Job Description - Software Engineer UE - P3 Engineer.docx....
782,jl_f7aeaf0fc34c7c55,permanent,data+engineer,7 days ago,Lead Scala Engineer - Early Stage Startup - Analytics,Linux Recruit,"£70,000 - £75,000 a year",London,,We are looking for someone who can work alongside the existing developer working on a big data analysis platform....
783,jl_38345ddc97222b74,permanent,data+engineer,30+ days ago,Systems Engineer – Test/Trials,Prospero Engineering,"£25,000 - £35,000 a year",Honiton,,Systems Engineer – Test/Trials. Working in collaboration with analytical trials engineer. You will be working in tandem with a Systems engineer working on the...
784,jl_8abbd2b6a9c3b771,permanent,data+engineer,17 days ago,Rig Test Engineer,Fircroft,,Norwich,32 reviews,Fircroft is registered as a Data Controller with the Information Commissioner as required under the General Data Protection Regulation 2016/679....
785,jl_7f12b78be4e59f85,permanent,data+engineer,29 days ago,Development Engineer,Ionic Recruitment,"£35,000 - £45,000 a year",Merseyside,,This is a brilliant opportunity for an ambitious Development Engineer to join the company and work on a wide range of housing developments....
786,jl_e669736229fa467a,permanent,data+engineer,8 days ago,Process Engineer,Scantec,,Sellafield,2 reviews,"The constitution of the basic data (collecting input data from sites). As a ""Nuclear decommissioning & dismantling"" engineer, you will have the following..."
787,jl_3a62d967b186d36a,permanent,data+engineer,15 days ago,Commissioning Engineer,Bonfire Enterprise,,Rotherham,,The Commissioning Engineer will:. Qualified engineer in an electrical or chemical discipline. Have at least 5 years demonstrable experience as a commissioning...
788,jl_457f629651575504,permanent,data+engineer,1 day ago,Devops Engineer,William Alexander Recruitment Ltd,"£70,000 a year",London,,DevOps Engineer (VSTS - Visual Studio Online). They need an Azure DevOps Engineer / Cloud DevOps Engineer with strong Azure DevOps / VSTS / Visual Studio Online...
789,jl_06ab487222415c5d,permanent,data+engineer,19 days ago,It Support Engineer,Etech Partners,"£35,000 a year",London,,Our Privacy Notice describes our policies and practices regarding collection and use of your personal data. My Client are a Private Investment Bank are looking...
790,jl_d198e4412fda9ba6,permanent,data+engineer,15 days ago,Quality and Improvements Engineer,Michael Page UK,"£30,000 - £35,000 a year",Port Talbot,32 reviews,As the Quality and Improvements Engineer based in Port Talbot you will be required to:. Develop the required reporting and analysis to review customer complaint...
791,jl_42cb084ead76fb37,permanent,data+engineer,30+ days ago,Engineer - Technical Sales Support,Oxford Instruments plc,,Bristol,,"Prepare and maintain accurate data base of cost/margin information. At Oxford Instruments Plasma Technology, We offer flexible, configurable process tools and..."
792,jl_299ca1223aa83da7,permanent,data+engineer,30+ days ago,Digital Designer,Babylon Health,,London,,"There’s a lot to do, so we need someone who can prioritise and make decisions intelligently using data to direct them...."
793,jl_a913e98d0ea0e24c,permanent,data+engineer,30+ days ago,Senior Engineer - Active Noise Control,Group Lotus,,Hethel,4 reviews,Test data reporting and documentation. Experienced in LMS and Head Acoustics data acquisition analysis software....
794,jl_15247da82a1af050,permanent,data+engineer,13 days ago,Proposal Engineer,Search Consultancy,,Chorley,179 reviews,"Working with our engineers and designers to develop and quote cost effective solutions. They are seeking a motivated, customer focussed, Proposals Engineer with..."
795,jl_8a2b30c937050783,permanent,data+engineer,30+ days ago,New Product Design Engineer,Michael Page UK,"£30,000 - £45,000 a year",Surrey,32 reviews,Lighting Design Engineer profile:. A highly capable Product Design Engineer with knowledge in developing LED lighting products....
796,jl_2545771023bebbb6,permanent,data+engineer,30+ days ago,Data Scientist - Hedgefund,Harnham,"£80,000 - £85,000 a year",London,6 reviews,As a Data Scientist you will be:. They are now looking into deep learning applications and looking for a senior Data Scientist to come on board....
797,jl_1c0dfc726fe63404,permanent,data+engineer,6 days ago,Production Engineer,Jonathan Lee Recruitment Ltd,,Warwickshire,4 reviews,Manufacturing - Permanent - Warwick - Attractive - Production Engineer. Qualifications & Requirements of the Production Engineer....
798,jl_aa24fb7b9b50785d,permanent,data+engineer,30+ days ago,Asset Integrity Engineer - Offshore Wind,The Green Recruitment Company,"£60,000 - £80,000 a year",Ramsgate,,"Lead Engineer – Asset Integrity Team. Outline and manage all condition monitoring, inspection and maintenance data collection activity, collate and integrate..."
799,jl_6ab5faf13e5b1ddc,permanent,data+engineer,1 day ago,Quality Engineer,Envisage Recruitment Ltd.,,Coventry,,Proactively drive issues through data analysis. Our client a global automotive organisation are looking for an experienced quality Engineer due to their...
800,jl_e1e2f6df5e24e52e,permanent,data+engineer,21 hours ago,Quality Engineer,Pertemps Network Group,"£30,000 - £40,000 a year",Cheltenham,520 reviews,Stand in for the Principal Quality Engineer when required. Other tasks as defined by the Principal Quality Engineer and/or Head of Quality Assurance &...
801,jl_2fc398c0ac9ef855,permanent,data+engineer,21 days ago,"Data Engineer - AWS, Redshift, Spark",Agile Recruitment Ltd,,Bristol,,"You'll develop a large high throughput distributed data platform and engineer data pipelines and data storage solutions utilising tooling like AWS, including S3..."
802,jl_d52f08e0ce577ac4,permanent,data+engineer,8 days ago,Senior ISTAR Systems Engineer,General Dynamics UK,,Wales,3 reviews,"The immediate position is within the AJAX Project Team as an ISTAR Engineer, reporting directly to the GDUK ISTAR Lead Engineer within the Electrical Systems..."
803,jl_7969645840884cee,permanent,data+engineer,30+ days ago,"Machine Learning Engineer (Hadoop, Data Sets, Java)",Harrington Starr,,Hayes,,"Machine Learning Engineer (Hadoop, Data Sets, Java) – Central London. Previous experience of time series data and data sets (essential)...."
804,jl_6f26295d89656b46,permanent,data+engineer,2 days ago,Customer Support Engineer,Rock People Group Ltd,"£26,000 a year",Poole,,Customer Support Engineer (2nd line support). As a Customer Support Engineer your responsibility is to deliver outstanding technical customer service to clients...
805,jl_131034bb2a383d96,permanent,data+engineer,1 day ago,Database Ops Engineer,Opus Recruitment Solutions,"£40,000 - £50,000 a year",London,,"I am currently working with a non-profit organisaiton that are looking to take on Database Ops Engineers. They are looking to expand their tech team, this role..."
806,jl_f2585ca5e9727fff,permanent,data+engineer,30+ days ago,DevOps Engineer,Whitbread Plc,,London,229 reviews,Facilitates data requirements across all environments. We have an exciting opportunity for a DevOps Engineer to join our digital hub within Whitbread....
807,jl_aecc02cf837264df,permanent,data+engineer,18 days ago,Field Engineer,Intech Recruitment.,"£24,000 - £28,000 a year",Birmingham,,This processing will be carried out in accordance with the UK Data Protection Act 1998. A leading Automatic Door organisation are looking to employ Automatic...
808,jl_7aa93ed5f52fd3f8,permanent,data+engineer,30+ days ago,Senior FPGA Engineer,Roke,,Romsey SO51,,We are currently seeking a talented Senior FPGA Engineer with experience in developing DSP related algorithms utilising a range of real-time embedded platforms...
