,job_id,job_types,job_tag,post_time,job_title,company,salary,location,no_of_review,job_summary
273,jl_3c96c33b6981aec0,permanent,data+analyst,2 days ago,Information Security Analyst,V&A,"£40,000 - £45,000 a year",South Kensington,5 reviews,We are seeking an Information Security Analyst to join the IT department. The Information Security Analyst role will be responsible for the day-to-day actions...
274,jl_dda98fafc325445a,permanent,data+analyst,30+ days ago,Econometrician,Ladbrokes Coral Group,,Gibraltar,"1,693 reviews","Data preparation including defining, transforming and structuring data so that the data is ready for econometric and other forms of analysis...."
275,jl_4ee4855ea3801b72,permanent,data+analyst,16 days ago,Tableau Data Visualisation Analyst,Harnham,"£40,000 - £50,000 a year",Haywards Heath,6 reviews,DATA VISUALISATION ANALYST. If you are interested in this Data Visualisation Analyst role please apply via this site....
276,jl_faa3b43f33b83f47,permanent,data+analyst,23 days ago,Commercial Data Analyst,Alexander Lloyd,"£32,000 a year",Crawley,,As a Business Data Analyst you will be responsible for:. Conducting data analysis. Alexander Lloyd Finance and Accountancy is the leading recruiter of part...
277,jl_07886623534026d4,permanent,data+analyst,22 hours ago,Finance Analyst,"Department for Digital, Culture, Media and Sport","£32,618 - £44,116 a year",London,,The post-holder analyst will also:. Some of the projects that the finance analyst is likely to work on over the next year are:....
278,jl_fe43527ce7861a02,permanent,data+analyst,6 days ago,Senior Data Scientist / Senior Statistical Analyst,Blue Pelican,"£50,000 - £65,000 a year",London,,Senior Data Scientist / Senior Statistical Analyst. We are searching for an experienced Statistical Analyst or Data Scientist to join this famous marketing...
279,jl_c3bd791d65eda223,permanent,data+analyst,30+ days ago,Compliance Data Analyst,CAS Recruitment,"£25,000 - £35,000 a year",Coventry,,(SW139) Compliance Data Analyst. CAS Recruitment are proud to be recruiting a Senior Compliance Data Analyst on behalf of our leading European customer....
280,jl_6bf10281bc4d9230,permanent,data+analyst,1 day ago,Business Analyst,BJSS,,Glasgow,,"As a Business Analyst you will:. Our team of business Analysts draw on a diverse, rich set of experiences and skills...."
281,jl_d626f176eabbad6a,permanent,data+analyst,27 days ago,Payment Optimisation Analyst,Barclays,,Northampton,"4,332 reviews","Payment Optimisation Analyst. Payment Optimisation Analyst - 90172877. Data Analysis – ability to source and interpret data, and come up with the findings and..."
282,jl_b4de1b43ef66b168,permanent,data+analyst,9 days ago,Finance Analyst,Superdry,,Cheltenham GL51,280 reviews,"A great opportunity to progress your career in finance with global, fast paced and growing brand. Able to analyse data, presenting your findings clearly and..."
283,jl_9d93a0c498de2117,permanent,data+analyst,1 day ago,Regulatory compliance analyst,Thames Water Utilites,"£44,000 a year",Reading,16 reviews,"The role also requires an individual with excellent project management skills, who can drive continuous improvement and work under pressure in a fast paced..."
284,jl_28e341689e5aa5f3,permanent,data+analyst,30+ days ago,Senior Data Solutions Analyst,Barclays,,Vale of Glamorgan,"4,332 reviews",Senior Data Solutions Analyst - 90199650. A successful individual would develop into an exceptionally strong Data Solutions Analyst....
285,jl_18288481c9ccfa44,permanent,data+analyst,1 day ago,Commercial business analyst,Thames Water Utilites,"£37,000 a year",Reading,16 reviews,"As a Commercial Business Analyst, your time will predominantly be split between data analytics, supporting sourcing managers with market analysis, and..."
286,jl_a93bb28638f433fa,permanent,data+analyst,30+ days ago,Data Integration Support Analyst (ETL),Legal & General Investment Management,,London,15 reviews,Having played a Business Analyst role within a Data Integration development / change environment. Must have worked in a fund/asset management company as a ETL...
287,jl_4a7900a824faea56,permanent,data+analyst,8 days ago,People Data Manager,Virgin Care,"£37,000 a year",Warrington,29 reviews,"We are currently seeking a People Data Manager to work at our office near Daresbury. Since 2006, we’ve delivered innovative and refreshing health and social..."
288,jl_f53f9d47e5cced1d,permanent,data+analyst,6 days ago,BI/Data Analyst - Reading - 50-55k + Benefits,Evolution Recruitment Solutions,"£50,000 a year",Reading,,Suggest and design innovative solutions for data insight utilising tools like Tableau or SQL server. BI/Data Analyst - Reading- 50-55k + Benefits....
289,jl_0e58046016e8d8ca,permanent,data+analyst,1 day ago,Senior Market Analyst,SSE,,Glasgow,180 reviews,Senior Market Analyst. The role of Senior Market Analyst will be a key resource for analysis and modelling capability....
290,jl_c624debc8605b21d,permanent,data+analyst,6 days ago,Consumer Insights Analyst,Walgreens Boots Alliance,,Nottingham,294 reviews,"You will have experience of analysing large sets of data, including experience of extracting and manipulating large data sets through SQL, SAS or similar query..."
291,jl_0439afcf482f86c3,permanent,data+analyst,21 days ago,Pension Calculation Analyst,Equiniti,,Crawley,60 reviews,"As part of the delivery, the Pension Calculation Analyst will be responsible for reviewing and understanding scheme rules and other scheme documentation,..."
292,jl_f18c20ef1cb08258,permanent,data+analyst,17 hours ago,Pricing Analyst,Paddy Power Betfair,"£35,000 - £40,000 a year",Hammersmith,242 reviews,"O Can accurately brief analysts to derive the data required. The team is a fast paced, data driven and customer facing team within Betfair that are primarily..."
293,jl_f601b0e96e2a341c,permanent,data+analyst,20 days ago,Operational Analyst,Defence Science and Technology Laboratory,"£24,000 - £44,352 a year",Fareham,17 reviews," A range of staff discounts for high street and online shopping, restaurants and days out.  Explore and visualise data to present its story in a meaningful..."
294,jl_4165d61bca04de1e,permanent,data+analyst,22 hours ago,CRM AND DATA SYSTEMS ANALYST,Spring,,Milton Keynes,32 reviews,"CRM and Data Systems Analyst. Ensuring best practice for data management is followed, data quality is maintained and data use is approved, documented and..."
295,jl_ddaf4b30f7df29c9,permanent,data+analyst,10 days ago,Intel Assistant,Keoghs,,Liverpool,3 reviews,Manual entry of data onto various internal databases. Decision making on what enquiries can be followed up and liaising with the analyst and file handler...
296,jl_55a7491149b12f26,permanent,data+analyst,8 days ago,Power Portfolio Analyst,Gazprom Marketing & Trading,,London,7 reviews,"Responsible for initial recording and review of contractual terms and PPA and adhere to internal processes when completing new client set up, oversight of..."
297,jl_697c90d5c5425a21,permanent,data+analyst,23 hours ago,Sustainability Analyst,Mattinson Partnership,"£20,000 - £24,000 a year",London,,Sustainability - analyst - energy - carbon management - sustainable design - graduate - London - sustainability consultant - climate change....
298,jl_da6d308c5b33ac1b,permanent,data+analyst,2 days ago,Information Security Analyst,Catalyst Housing Association,"£50,000 a year",Ealing,,We are currently seeking an experienced and proactive Information Security Analyst to join our well-established but highly ambitious organisation....
299,jl_2421a3f3221055ce,permanent,data+analyst,24 days ago,Investment Data Analyst,BRUIN Financial,,London,,They are looking for an Investment Data Analyst to join their team. Provision of data for database maintenance....
300,jl_5b6a8fe4ac125d9e,permanent,data+analyst,30+ days ago,Sales Analyst,Jet2.com and Jet2holidays,,Leeds,135 reviews,"In return, we offer an excellent salary and benefits package with fantastic opportunities for progression in a growing business...."
301,jl_479b6bfad53f88f0,permanent,data+analyst,30+ days ago,BI & Performance Data Analyst,Aspire Data Recruitment,"£30,000 a year",Liverpool,,The BI & Performance Data Analyst will:. The BI & Performance Data Analyst will have:. Excellent data management and data analysis experience....
302,jl_f3f362836b23e451,permanent,data+analyst,21 days ago,Data Analyst,Omega Resource Group,"£27,000 a year",Swindon,28 reviews,Previous Data Analysis experience. Managing the collection of compliance data from Honda suppliers throughout the EU and ensuring data collection deadlines are...
303,jl_5235fdc9b7648947,permanent,data+analyst,30+ days ago,Data Analyst,Asset Resourcing,"£35,000 a year",St Albans,,Data Analyst / CRM Specialist:. This is a real opportunity for a talented data analyst to help shape the future of their data insights strategy and produce best...
304,jl_b42f616b52429f51,permanent,data+analyst,27 days ago,Graduate Data Analyst,Core Talent Recruitment,"£20,000 - £25,000 a year",Reading,,The successful candidate for the Graduate Data Analyst will be responsible for analysing data and seeing what common trends there are....
305,jl_24448cc39998f1ed,permanent,data+analyst,11 hours ago,Analyst,Plumstead Bond Limited,"£26,000 - £28,000 a year",Bracknell,,"French Speaking Analyst. You will have the opportunity to progress in a fast paced, commercially driven environment were your ability to make a difference and..."
306,jl_9986350386f1f653,permanent,data+analyst,8 days ago,Graduate Data Scientist/ Analyst,VANRATH,,Belfast,,"Physics Graduate, data analyst, Data scientist, graduate, statistician. Experience with data science tools (Matlab, Python)...."
307,jl_e6020b29460974e2,permanent,data+analyst,30+ days ago,Data Analyst- Solar Energy,The Green Recruitment Company,,London,,"Carry out training for Project Managers and other data analysts. At least 2 years of experience working as a data analyst in the renewable energy industry,..."
308,jl_ee375349df95bf5f,permanent,data+analyst,16 days ago,Data Science Analyst,Harnham,"£46,000 - £60,000 a year",London,6 reviews,"This is an opportunity to join a leading UK insurer as a Data Scientist in their London office. As a Data Scientist you will be:. £50,000 - £60,000 + Benefits...."
309,jl_612d1748451b45d9,permanent,data+analyst,10 days ago,Category Analyst,B&Q,"£23,000 - £30,000 a year",Eastleigh SO53,"1,648 reviews",Secure accurate customer facing data and content for product/projects across all sales channels. Experience of using data to adapt commercial plans and take...
310,jl_4b5587dbbe9bac45,permanent,data+analyst,20 hours ago,Purchasing Analyst,Elior,,London,756 reviews,"Your key responsibilities as the Purchasing Analyst will consist of:. As a Purchasing analyst, you are also eligible Eye Care Vouchers...."
311,jl_651b3d73c2e34606,permanent,data+analyst,30+ days ago,Data Analyst,Ashdown Group,"£35,000 a year",Goole,,If you are an experienced Data Analyst looking for a new challenge please send me your CV immediately. They have a new requirement for an experienced and highly...
312,jl_c32ceef64f90991c,permanent,data+analyst,1 day ago,Data Visualisation Analyst,Change Recruitment Group,,Scotland,43 reviews,Liaise with stakeholders to review big data and data analytics. Experience of Big Data projects. Are you experienced with Data Visualisation tools ?...
313,jl_339bd840359fd44b,permanent,data+analyst,30+ days ago,Data Analyst,OSR Recruitment,"£30,000 - £35,000 a year",Basildon,10 reviews,OSR are recruiting a Data Analyst on behalf of one of the UK’s largest online manufacturing supply company based in Essex....
314,jl_d658cbde8adda7db,permanent,data+analyst,30+ days ago,Communications Analyst,Legal & General Group Plc.,"£33,000 a year",Hove,10 reviews,"LGIM internal data as at 31 December 2017, including derivative positions and advisory assets. Excellent communication skills when working with teams who may be..."
315,jl_2d4dded4495ba275,permanent,data+analyst,26 days ago,Data Analyst,Morgan Turner,,Burnley,,"Our client a well-established company are looking for a professional, motivated and results driven Data Analyst...."
316,jl_391a1540d25950cc,permanent,data+analyst,1 day ago,Business Analyst,Capita Plc,,Bury St. Edmunds,"2,017 reviews","Experience of Workflow Design, Physical Derivation Table, Physical Data Model & Data Dictionary and Logical to Physical Mapping is desirable...."
317,jl_8742a4c889fe7e6b,permanent,data+analyst,4 days ago,Aviation analyst,Mott MacDonald,,Croydon,394 reviews,"Analysis of data sets, mapping of data trends, research into specific aviation and business subjects. Data analysis and database use...."
318,jl_3d555eb1942431b4,permanent,data+analyst,7 days ago,HR Information Analyst,Nationwide Building Society,"£25,421 - £36,720 a year",Swindon,488 reviews,"Influencing data integrity through the proactive discussion of data issues with the teams responsible for solving them, and continued focus on balancing Data..."
319,jl_80f559763f784338,permanent,data+analyst,17 days ago,Information Security Analyst,National Trust,"£38,077 a year",Swindon,358 reviews,"This is an exciting opportunity for an Information Security Analyst, within the National Trust. An excellent understanding of industry legislation, regulation..."
320,jl_8f14c8b14ded8d2b,permanent,data+analyst,23 days ago,FP&A Analyst,Ladbrokes Coral Group,,Gibraltar,"1,693 reviews",Ability to manage and manipulate large volumes of data in a fast paced environment. Prepare regular reporting and analysis by using data sources such as the...
321,jl_9c662e8c979c3d3b,permanent,data+analyst,30+ days ago,Data Analyst - SQL,Aspire Data Recruitment,"£25,000 - £35,000 a year",London,,The Data Analyst will be responsible for working alongside members of the data and analytics team to provide data and reporting which will form the basis of...
322,jl_18e9aae24c7909ad,permanent,data+analyst,30+ days ago,Senior Data Analyst,Jet2.com and Jet2holidays,,Leeds,135 reviews,"Reporting to the Lead Data Analyst, the Senior Data Analyst will be responsible for developing and delivering key digital data to drive business decisions..."
323,jl_e90fab1f442417a4,permanent,data+analyst,5 days ago,Risk Analyst,BNP Paribas,,London,"2,545 reviews",Ability to work with large data sets. Ability to work in a fast paced environment. Contribute to the development of the Risk Management infrastructure through...
324,jl_5094130ba8c62735,permanent,data+analyst,9 days ago,Data Services Developer,Carnival,,Southampton SO15,53 reviews,"You will be working with Project Managers, Business Analysts, Solution Architects and other SMEs to design and deliver data solutions, using batch and real time..."
325,jl_978f9afc167bc5cc,permanent,data+analyst,2 hours ago,Technical Operations Analyst,Capita Plc,,Greater Manchester,"2,017 reviews","NOC/ TOC Analysts. Analysts will be privy to comparative, market sensitive Customer operational performance data, so must act with highest levels of discretion..."
326,jl_d740b5f70ec2b271,permanent,data+analyst,30+ days ago,Research and Statistical Analyst (Housing and Land),Greater London Authority,"£39,501 a year",London,9 reviews,"The Greater London Authority (GLA) is a unique city government for Greater London, supporting the directly elected Mayor and scrutinised by the elected London..."
327,jl_51f8f4e281d45203,permanent,data+analyst,5 days ago,Data Analyst,Alfa IT Recruitment Ltd,"£35,000 - £50,000 a year",London,,A global leader specialising in independent tax and advisory based London is actively seeking a Data Analyst to be involved in the all aspects of data analytics...
328,jl_adf13e74028fe2eb,permanent,data+analyst,30+ days ago,Data Analyst - HR,Mcgregor Boyall,£300 - £400 a day,London,5 reviews,"An opportunity has arisen for a Data Analyst to work for a large Banking client in London. Own, manage and maintain the master data sets for a large project..."
329,jl_e34a30a668c7f06e,permanent,data+analyst,8 days ago,MARKETING DATA ANALYST,Netbox Recruitment,"£30,000 a year",Edinburgh,,"This is an instrumental role within the business, where you will lead the insight on the effectiveness of all marketing activities, online and offline and will..."
330,jl_fad422c3074d9497,permanent,data+analyst,30+ days ago,Data Analyst/Commercial Analyst,Accountancy Divisions,"£25,000 - £28,000 a year",Horsham,,This can be either a Maths/Stats/Economics graduate with Data Analysis Experience or a Commercial/Data Analyst with a number of years within a relevant field....
331,jl_ce0a20bfc5cc2046,permanent,data+analyst,9 days ago,Strategy Senior Analyst,Gemserv,"£27,500 - £31,000 a year",London,3 reviews,Strategy Senior Analyst. Gemserv are currently looking to recruit a Senior Analyst to work in our London office....
332,jl_a9d8e990661e226e,permanent,data+analyst,16 days ago,System and Development Analyst,Jet2.com and Jet2holidays,,Leeds,135 reviews,"You will be able to analyse data, produce reports to identify and resolve problems. In return, we offer an excellent salary and benefits package with fantastic..."
333,jl_47846cc0f7011f2b,permanent,data+analyst,30+ days ago,Data Analyst,Boston Link,,Isle of Man,,They are looking for an inquisitive Data Analyst to join the Business Intelligence Team in the Isle of Man to explore data and reveal the underlying patterns...
334,jl_c035d5ad8d432967,permanent,data+analyst,13 days ago,"Senior Analyst, TRACER Unit, Intelligence Collection-",National Crime Agency,"£34,971 - £40,000 a year",London,22 reviews,"London based roles also attract an additional London weighting allowance of £3,258 per annum. Intelligence Analyst trained (NCA Analyst Foundation Part 1 and..."
335,jl_4b59b79a1a94c5fa,permanent,data+analyst,2 days ago,Senior Retail Analyst,Jet2.com and Jet2holidays,,Leeds,135 reviews,The successful candidate will be proficient in the use of Excel and is comfortable processing large volumes of data with excellent attention to detail....
336,jl_e715ec0521ad5dfb,permanent,data+analyst,14 days ago,Customer Behavioural Insights Analyst,Hamblin Employment Group,,Isle of Man,,"Extracting and analysing very large, multi-dimensional data sets. Analytical mind, with the ability to extract knowledge from data...."
337,jl_1d2f82494159a3b3,permanent,data+analyst,21 days ago,Sales Planning Analyst,Group Lotus,,Hethel,4 reviews,"Identify,attain and evaluate data to assist and propose business decisions within eachdesignated markets, this should include input from senior &..."
338,jl_956b7d847529fb27,permanent,data+analyst,8 days ago,Client Reporting Analyst,Burges Salmon,,Bristol,4 reviews,"To be successful as our Client Reporting Analyst, you will need to demonstrate the following:. As our Client Reporting Analyst you will be responsible for..."
339,jl_d820ed358e69ecf8,permanent,data+analyst,24 days ago,Reporting Analyst,Alliance Healthcare,,Chessington,284 reviews,"If you are looking for your next step with an innovative, growing company, Alliance Healthcare can offer you a great working environment with rewarding..."
340,jl_2ce17c7c094c59c9,permanent,data+analyst,22 days ago,Data Analyst,Green Recruitment Company,"£38,000 a year",Redhill,,Expert in data analysis and reporting. The Green Recruitment Company are working alongside one of the largest and leading international energy suppliers in...
341,jl_750c502d1fe6325b,permanent,data+analyst,2 days ago,Bi Analyst,4it Recruitment Ltd,"£30,000 a year",Reading,,"Data warehouse Testing experience. BI Test Analyst essential skills:. The successful BI Test Analyst should have strong Data Warehouse testing experience,..."
342,jl_68ad42a2f95cfe5c,permanent,data+analyst,4 hours ago,Senior Data Analyst,La Fosse Associates,"£60,000 - £70,000 a year",Slough,2 reviews,An Senior Data Analyst with strong SQL skills. An Senior Data Analyst with experience in building predictive models....
343,jl_5284ed420f442117,permanent,data+analyst,12 days ago,Data Analyst,Recruitment Solutions (Folkestone),,Folkestone,,A wonderful opportunity with a global manufacturing organisation in the area for a Data Analyst (Supply Chain – Planner)....
344,jl_acc3d3494b1089f1,permanent,data+analyst,19 days ago,Data Analyst,Cathedral Appointments Limited,,Bristol,,"Able to demonstrate considerable MS SQL experience, the Data Analyst will be responsible for mapping out the clients existing systems, maintaining the integrity..."
345,jl_9db7fe8f803dd8dc,permanent,data+analyst,2 days ago,Business Analyst (Grade G/J),Greater Manchester Police,"£27,246 - £37,191 a year",Manchester,84 reviews,A good understanding of the Business Analyst role and the tools and techniques they use; Experience of gathering and analysing data from various sources to...
346,jl_fe8180ca65b7e958,permanent,data+analyst,30+ days ago,"Graduate Data Analyst,",Aspire Data Recruitment,"£26,000 a year",Manchester,,"Graduate Data Analyst, Manchester. Design and implement data solutions, with appropriate controls to monitor integrity of data and deliver regular management..."
347,jl_7a1e1aa3c20a05d0,permanent,data+analyst,10 days ago,Energy Analyst and Environment Advisor,Driver and Vehicle Licensing Agency,"£25,259 - £26,120 a year",Swansea SA6,20 reviews," Contributing to the Agency Annual Report and Accounts and the Business Plan, by supplying legally required data and providing meaningful analysis of that data..."
348,jl_8735accc459a0f5f,permanent,data+analyst,20 days ago,Data Analyst,Capita IT Resourcing,"£20,000 - £25,000 a year",Edinburgh,4 reviews,"Ensure integrity, availability, and relevance of all data. Support the operation in all aspects of data insight and report production...."
349,jl_52c719000f642030,permanent,data+analyst,30+ days ago,Enterprise Data PMO Analyst,Barclays,,London,"4,332 reviews","Enterprise Data PMO Analyst - 90199020. Support working groups that coordinate activities across the programme including, Data Lineage, Authoritative Data..."
350,jl_d91bc49e1fefa62f,permanent,data+analyst,30+ days ago,Read Analyst,Gazprom Marketing & Trading,,Manchester,7 reviews,"The role will enable the expansion of the Gazprom Energy business in the UK by providing a best in class service for all customers ensuring that all activities,..."
351,jl_6af3bf4dc0c8cb79,permanent,data+analyst,30+ days ago,Forensic Data Analyst,Harnham,"£45,000 - £50,000 a year",London,6 reviews,"Forensic Data Analyst. Data loading, data analytics and producing visualisation output. They are currently growing an innovative Forensic Analytics team who are..."
352,jl_f7ebb9e9ceefd8d0,permanent,data+analyst,30+ days ago,Analyst,Knight Frank,,London,63 reviews,"The ideal applicant will have experience in researching markets, ideally within the real estate market and will have strong data analysis skills...."
353,jl_dd03514910a8e1bc,permanent,data+analyst,21 days ago,Junior Data Analyst,Talentpoint Jobs,"£30,000 - £40,000 a year",London,,"This is a brand new opportunity for a Junior Data Analyst to join a growing team within an Ecommerce business based in Central London, they are investing..."
354,jl_37e9f0688c42f7d6,permanent,data+analyst,30+ days ago,Data Visualisation & Insight Analyst,Aspire Data Recruitment,"£25,000 - £35,000 a year",Manchester,,"Data Visualisation & Insight Analyst. The perfect candidate will not only be a skilled analyst, you’ll be someone that can bring new ways of thinking and..."
355,jl_d8117ee870097701,permanent,data+analyst,8 days ago,Campaign Insights Analyst,Walgreens Boots Alliance,,Nottingham,294 reviews,"You will have the chance to be part of something ambitious, something innovative and have an impact on a global scale...."
356,jl_8033153dd118ea1f,permanent,data+analyst,30+ days ago,SQL Data Analyst,Deerfoot,"£45,000 a year",London,,"Data Analyst, SQL Analyst, Technical Analyst, BI Analyst, Information Analyst, SQL Developer, Report Analyst. SQL Data Analyst – C...."
357,jl_dfae7c925d51126f,permanent,data+analyst,2 days ago,Service Desk Specialist,Driver and Vehicle Standards Agency,"£25,259 - £26,120 a year",Nottingham NG1,20 reviews,"Youll be part of an innovative and inclusive organisation that invests in all our people, ensuring we have the diverse skills to deliver transport that moves..."
358,jl_6dd35762c4bf34b5,permanent,data+analyst,23 days ago,"Data Analyst - PowerBI experience - Liverpool - GBP35,000",Nigel Frank International Limited,"£30,000 - £35,000 a year",Liverpool,43 reviews,"Data Analyst - PowerBI - Liverpool - £35,000. This is a great opportunity to join an outstanding company who is looking for a Data Analyst...."
359,jl_57a2b1b7b52cc8c2,permanent,data+analyst,3 days ago,INSIGHT ANALYST,Salmon Limited,,Watford,,"Building dashboards and data visualisations. Digital Insight Analyst required to join our Digital Intelligence division, you will be responsible for analysing..."
360,jl_39f012f60aa8da41,permanent,data+analyst,16 days ago,Commercial Data Analyst,Brook Street,"£25,000 a year",St Albans,88 reviews,An exciting opportunity has arisen to join a growing business as an analyst. In order to be considered for this role you will have a solid analyst background...
361,jl_2c9623b7965045ed,permanent,data+analyst,8 days ago,Sr. Project Analyst,Capita Plc,,Newbury,"2,017 reviews","Project Analyst with Capita ONE (Home Based):. You’ll be joining a network of some of the most experienced, innovative and dedicated people in the country - the..."
362,jl_141ead53331513a8,permanent,data+analyst,14 days ago,Finance Analyst - Trading,Müller UK & Ireland,,Market Drayton,100 reviews,Support in preparing Muller Y&D transfer price data. Detailed reconciliation of all 3rd party milk supplier and customer data....
